,职位名称,职位名称关键字,职位薪资,公司名称,地区,工作经验,学历要求,职位描述要求,Web,Css,Html,Javascript,Js,Jquery
0,Web前端开发工程师,前端开发,14000.0,深圳市睿服科技有限公司,深圳,3.0,大专,工作职责1、负责前端页面（Web）和H5页面的构建，各类交互设计与实现；2、前端样式和组件开发的模块开发；3、精通前端工程化构建工具，至少有一个大型项目开发经验；4、负责与微信公众号、微信小程序、app等移动端数据交互及配置部署；5、通过技术手段，提升用户体验并满足高性能要求；6、配合后台开发人员完成项目；岗位要求：1、了解W3C标准，熟练使用HTML、CSS、JavaScript、Ajax、DOM等前端技术，懂python优先；2、了解WEB标准化、模块化、性能优化方法，了解可用性、可访问性和安全性；3、计算机相关专业，3年以上相关工作经验；4、具备MVVM框架开发经验，如React、VueJS、AngularJS等，并对Element、iView有深刻了解并有相应的开发经验；5、精通JavaScript、AJAX、DOM、jQuery等技术；6、熟悉NodeJS，熟练使用Grunt、Gulp、Webpack等构建工具；7、有良好的代码编写习惯，有自主学习能力，有良好的团队合作意识及积极的心态。综合一档社保；全日制大专以上学历，学信网可查；介意外包勿投；多上班地址可选，请放心投递。职能类别：其他,1.0,1.0,1.0,1.0,0.0,1.0
1,Web前端开发工程师,前端开发,9000.0,广州小兵过河信息科技有限公司,广州,1.0,大专,岗位职责：负责web前端的开发工作；负责web前端系统分析、优化与架构工作。任职要求：1.大专以上学历，一年以上工作经验；2.熟练掌握vuejs/vue-router/vuex技术栈开发、vue脚手架和webpack构建工具的使用并有实际项目开发经验；3.熟悉流行的UI框架，熟悉W3C标准，具有良好的ES6+基础，对前后端分离、Web语义化、性能优化、浏览器兼容等有较为深刻的理解，较强的分析问题和解决问题的能力；4.思路清晰、良好的模块设计实现能力；优秀的代码编写能力，代码可读性强、复用性高；5.关注前端前沿技术研究，通过新技术服务团队和良好的业务沟通能力，责任心强；6.有小程序开发经验优先。,1.0,0.0,0.0,0.0,0.0,0.0
2,厦门驻场web前端开发工程师,前端开发,20000.0,北京众维网络技术有限公司,厦门,5.0,大专,"外派厦门，做GIS项目，有宿舍。（人员外包，只要能面试通过，薪资从优）1，5年以上前端开发经验，精通前端开发基本技能，如HTML、CSS、JavaScript、xml、json等；2，有丰富的前端研发经验, 熟悉VUE，做过相关项目3，有GIS或地图研发经验优先4、统招大专以上学历，学信网能查。",0.0,1.0,1.0,1.0,0.0,0.0
3,前端开发工程师,前端开发,12500.0,广东利元亨智能装备股份有限公司,惠州,0.0,大专,						岗位职责:1、 承担主要开发工作，对代码质量及进度负责；2、 协助系统架构设计师进行系统架构设计工作；3、 负责网站前后台的修改和升级，根据网站业务需要开发，制作和程序修改；4、 协助公司各部门，满足和协调公司各相关部门提出的网站技术需求；5、 参与进行关键技术验证以及技术选型工作。 任职资格:1、大专以上学历，3年以上Web前端项目开发经验；2、对页面代码结构及前端交互性能有深入的理解；对符合web标准的网站重构有丰富经验；3、面试时提供成功案例； 4、有良好的团队合作精神、高度的责任心、较强的自我管理能力及自驱力，可承受一定的工作压力。,1.0,0.0,0.0,0.0,0.0,0.0
4,Web前端开发工程师,前端开发,9000.0,济南汇通远德科技有限公司,长沙,0.0,无,技能要求：2、精通HTML/HTML、javascript、Json3、精通jQuery框架，熟悉Bootstrap框架4、熟悉不同浏览器之间的差异，能解决多浏览器间兼容性问题5、有kendo\react等研发经验的优先考虑岗位职责：1、参与工作流设计器、权限系统等功能的前端开发。2、参与平台原有功能的完善职能类别：										高级软件工程师									,0.0,0.0,1.0,1.0,0.0,1.0
5,Web前端开发工程师,前端开发,9500.0,湖南纳米娱乐网络科技有限公司,长沙,2.0,大专,岗位职责：1.公司业务后台的前端研发和维护，进行技术预研；2.配合APP端开发应用内web/h5页面。岗位要求：1.有2年及以上web工作经验，了解W3C相关标准，并有产品发布上线运营；2.熟悉web开发，html/css/javascript，熟悉DIV+CSS布局的HTML代码，熟悉面向对象程序设计；3.能够熟练构建Ajax交互，能解决常见的浏览器兼容问题；4.能熟练使用主流的JS开发框架（如Angular、React、Vue、jQuery、Bootstrap、ect.）5.对新技术保持敏感，不断探索，能够突破技术难点，对技术充满热爱，能够协助推进研发项目快速落地和迭代。,1.0,1.0,1.0,1.0,1.0,1.0
6,java前端开发实习生,前端开发,5250.0,广州北珠联科技有限公司,广州,0.0,高中,岗位职责:任职要求br1、大专及以上学历，计算机网络、电子信息、软件工程、电气自动化、测控、生仪、机电、数学或英语等专业。br2、有计算机语言基础者优先，如c语言、java、net、php等；工作态度端正，有责任感，组织性、纪律性强；具有良好的逻辑思维能力、团队合作能力；任职资格：1.年龄在18-30岁之间，高中以上学历；2.有志于往python行业发展；3.熟悉互联网络，熟练使用网络交流工具；4.逻辑思维、学习能力好5、每年享受国家规定的带薪年假、法定节假日等福利；,0.0,0.0,0.0,0.0,0.0,0.0
7,Web前端开发工程师,前端开发,14000.0,深圳市城润科技股份有限公司,深圳,3.0,大专,"岗位职责1、计算机或者相关专业专科学历，优秀者大专亦可；2、有3年以上WEB前端开发经验；3、熟练掌握JavaScript、Ajax、jQuery、vue、Json ,h5等Web开发技术及框架；4、熟悉模块化开发，功能与界面的剥离；5、对Web前台性能优化以及Web常见漏洞有一定的理解和相关实践；6、至少熟悉vue、vue、react其中一种框架；有以下任一经验的，优先录用:1、熟悉当前流行的 JavaScript 类库：vueJS,h5;2、编写过前端组件，在github有前端作品，或有参与知名项目的编码或缺陷提交",1.0,0.0,0.0,1.0,0.0,1.0
8,Web前端开发工程师,前端开发,9500.0,百川云计算（深圳）有限公司,深圳,1.0,本科,配合项目经理实现的前端界面，优化代码并保持良好的兼容性；2.熟悉前后端分离的开发流程，能够高效地与后端开发合作；3. 注重用户体验。基本技能要求：1.本科及以上学历，精通Web前端技术，1年以上相关开发经历，具有良好的代码规范意识；2. 熟悉React或Angular前端开发框架及相关技术栈3.精通JavaScript，基础扎实4.熟悉响应式布局5.精通HTML和CSS，网页符合W3C规范6.熟悉前后端分离的工作模式，缓存等概念7.英文读写能力良好，具有一定的英文沟通能力8. 熟悉PHP语言优先职能类别：										互联网软件开发工程师																			Web前端开发									关键字：Web前端开发,1.0,1.0,1.0,1.0,0.0,0.0
9,前端开发工程师,前端开发,12500.0,上海文思海辉金信软件有限公司,深圳,3.0,本科,做银行证券项目熟练掌握javascript，css等前端相关技术，使用过React、Angular以及vue等至少一个前端框架，能够顺利项目相关的前端开发工作，做过银行证券项目优先																		,0.0,1.0,0.0,1.0,0.0,0.0
10,Web前端开发工程师,前端开发,7000.0,昆明麦普测绘科技有限公司,昆明,1.0,大专,岗位职责：1.配合后端开发人员完成系统前端页面的开发；2.负责HTML5界面整体视觉效果设计、编辑、美化；3.对页面进行持续的优化，不断提升访问者的用户体验；4.解决vue项目的整体性能，如部署后的用户访问速度等。任职要求：1.大专及以上学历，计算机相关专业；2.1-3年Web前端开发经验；3.熟练运用HTML5、CSS3、JavaScript、vue.js等构建高性能的web应用程序，具有一定的美术设计功底，能够使用Photoshop处理图片；4.熟悉vue.js前端框架，熟练解决多种浏览器兼容问题以及vue项目性能问题；                          5. 良好的创意思维和理解能力，善于协作与沟通，具备良好的团队合作精神。    ,1.0,1.0,1.0,1.0,1.0,0.0
11,CocosCreator前端开发,前端开发,18500.0,成都品宏源创科技有限公司,深圳,0.0,无,要求：1.从事相关引擎工作三年以上，有完整的休闲创意小游戏上线项目经验2.熟练掌握c++及js/ts脚本语言3.熟练掌握cocosAPI4.能独立完成内存优化、包体优化、屏幕适配相关工作；5.能够独立打包以及接sdk者优先考虑,0.0,0.0,0.0,0.0,1.0,0.0
12,前端开发工程师（厦门）,前端开发,9000.0,深圳船奇科技有限公司,厦门,1.0,大专,岗位要求：2、熟悉W3C标准，精通DIV+CSS布局，熟练使用photoshop，能够手写html代码3、熟练使用主流JavaScript的框架（JQuery等）；4、掌握面向对象编程思想，能够高效的手写和修改js代码；5、有移动前端开发经验者优先；6、大专以上学历，1年以上前端开发经验工作时间：9:00-12:00 13:30-18:00 周末双休公司福利：1、入职即买五险一金2、定时下午茶、加班补贴、出差补贴3、法定节假日福利4、带薪年假，全勤奖5、年终奖金，员工旅游职能类别：										软件工程师																			互联网软件开发工程师									关键字：H5前端开发软件工程师web前端,1.0,1.0,1.0,1.0,1.0,1.0
13,WEB前端开发,前端开发,3750.0,山东壹家信息科技有限公司,淄博,0.0,无,任职要求：1精通css，html，能根据设计图设计出静态的网页。工具不限。2了解js，jquery的使用，尤其是其中的选择器部分。3能根据要求用ps做出设计图者优先录用4能做出适应各种设备的页面（响应式页面）者优先录用。5个人要求不急不躁，能与他人在工作方面能良好的沟通。工作时间：7小时,0.0,1.0,1.0,0.0,1.0,1.0
14,前端开发,前端开发,12500.0,上海浩方信息技术有限公司,北京,3.0,本科,、三年以上web前端开发经验；2、熟悉W3C规范，能熟练编写具有良好风格规范的HTML+CSS代码；3、精通JavaScript语法及特性，掌握JavaScript面向对象编程思想，理解Ajax工作原理；4、熟练使用jQuery、extjs、AngularJS、Vue.js、React、Bootstrap等前端框架中的一种或多种；5、能够使用原生JS编写JS组件、业务类库；6、熟练掌握HTML/CSS/XML及HTML5/CSS3；7、熟练使用web前端开发调试工具。,1.0,1.0,1.0,1.0,1.0,1.0
15,Web前端开发工程师,前端开发,4500.0,宁波万千星网络技术有限公司,宁波,0.0,无,岗位职责：1、熟悉使用常用的前端开发库，例如jQuery/Bootstrap等2、熟练使用Photoshop、Dreamweaver等常用工具软件进行设计稿切片、html代码编写3、与设计师和后台程序人员配合，高效率高质量地完成页面的实现工作岗位要求：1、专业不限，学历不限2、精通DIV+CSS页面制作，有大型网站建设经验；精通HTML，熟悉各种浏览器兼容处理3、精通JavaScript、Ajax等Web开发技术，实现网站页面特效、JS效果4、熟悉HTML5、CSS3的优先5、有移动设备研发经历的优先6、熟练使用Bootstrap框架者优先7、有php或者java语言应用能力者优先 8、接受应届毕业生薪资待遇：1、薪资3K-6K2、缴纳五险+节假日福利+定期户外活动3、每日工作8小时，双休,1.0,1.0,1.0,1.0,1.0,1.0
16,前端开发工程师,前端开发,12500.0,上海百事通信息技术股份有限公司,广州,2.0,本科,						岗位内容：任职资格：1、本科及以上，计算机相关专业毕业；2、2年以上前端开发经验，参与2个以上的项目建设开发工作；3、2年以上互联网前端开发经验，熟悉HTML5特性和HTML5最新规范，能够熟练运用HTML5特性构建移动端的WebApp，基于HTML5.0标准进行页面制作； 4、具备扎实的 JavaScrpt、HTML、CSS 知识，确保页面代码对各种移动设备浏览器的良好兼容性； 5、熟悉前端工程化与模块化开发，并有实践经验（如webpack、Vue-cli/Dva等）；6、熟悉 React 和 Vue前端 MV* 框架，并有项目经验；7、熟悉小程序开发，并有项目经验。职能类别：										Web前端开发									,1.0,1.0,1.0,0.0,0.0,0.0
17,Web前端开发工程师,前端开发,6000.0,四川斯宇信息技术有限公司,成都,1.0,大专,"、负责前端构建工具优化、工作流工具开发,及其他前沿技术研发方向调研；3、对UI提供的页面设计稿进行还原，与后台工程师协作，进行接口的调试；4、研发经理交办的其他工作。任职资格：1、具有2年或以上前端开发经验和实际的项目经验；2、精通JavaScript，精通 HTML5/CSS3，熟练使用React.js、Vue.js、Angular.js等至少一种框架，熟悉nodejs和npm；3、熟悉Git、SVN版本管理软件；4、有React Native移动app开发经验者优先；5、深刻理解Web标准，对界面重构有丰富经验，有成功案例；6、沟通能力强，具有良好的团队合作意识；职能类别：										Web前端开发									关键字：web工程师",1.0,1.0,1.0,1.0,1.0,0.0
18,前端开发工程师,前端开发,12500.0,深圳市安智信息技术有限公司,深圳,3.0,大专,"、本科及以上学历，3年以上前端重构与脚本开发经验;2、熟悉主流前端类库或框架,对React/Vue/Angular等有定的实践经验，了解MVC/MWM等设计模式，对单页应用的开发优化有一定的实践经验。3、熟悉Hybrid混合式开发架构，对cordova/react-native/小程序等框架原理定深度理解4、熟悉webpack/grunt/gulp等前端构建工具，并能实现工具的订制开发5、熟悉NodeJS，以及其他后端语言例如phpjava,net等,有一定的运维经验能力6、了解前端性能,掌握优化技巧,对页面性能和浏览器兼容有实践经验。          1、负责移动web端组件的封装开发和新一代框架建设;2、持续的优化前端Web页面的用户体验和性能:3、协助前端工作流程规范的制定和实施;4、研究新技术并帮助业务增长",1.0,0.0,0.0,0.0,0.0,0.0
19,信息部前端开发工程师,前端开发,9000.0,山东凤祥股份有限公司,聊城,2.0,大专,、利用HTML/CSS/JavaScript等Web技术进行产品的开发；2、 能够理解后端架构，与后端工程师配合，为项目提供最优化的技术解决方案；3、 能够理解基础需求和UI设计并进行分析，设计出符合用户使用习惯的前端操作界面，优化前端用户操作体验；4、负责前端核心功能和框架的研发，对前端性能、架构等方面进行改进与优化。任职要求：1、精通掌握html5、css3、javascript、VUE.js2、nodejs前端开发知识，并有相关的项目开发经验或成果3、熟悉前端工程化，用过git，gulp或webpack等工具，***有自己的github仓库4、精通掌握一种前端框架，比如vue/ReactJS/AngularJS，并有深刻理解,1.0,1.0,1.0,1.0,1.0,0.0
20,前端开发工程师,前端开发,12500.0,上海海万信息科技股份有限公司,佛山,3.0,大专,岗位职责：1、前端Web独立项目部署，前端代码开发2、根据项目需求，按时完成相关产品界面代码设计和功能开发工作3、扎实的代码规范和良好的框架设计思路4、前端开发资源优化，保证兼容性和执行高效性5、负责网站Web前端数据读取，数据绑定，功能交互，功能实现  6、关注技术细节，并能根据业务需求和相关数据，提出技术和架构上的改进；  7、熟悉金融行业业务开发者优先。任职要求：1、大学统招本科及以上学历，计算机及相关专业；2、3年以上（含3年）以上相关工作经验，有一定的项目管理和带团队的经验；3、熟练掌握vuejs/vue-router/vuex技术栈开发4、熟练掌握webpack构建工具的使用并有实际项目开发经验  5、熟练运用JavaScript，对JavaScript的作用域、闭包、ES6新语法、前端模块化、组件化等有深入理解6、具有娴熟的沟通技巧，执行力强，具有优秀的团队合作精神、敬业精神；7、至少熟悉jQuery、Vue、node.js等1门前端语言8、有银行经验或者电营系统者优先。,1.0,0.0,0.0,1.0,1.0,1.0
21,高级前端开发工程师,前端开发,16000.0,杭州云树网络科技有限公司,杭州,5.0,大专,、独立完成公司B/S系统的功能模块编码；2、参与公司前端框架的编写和整合；3、参与与服务端开发人员的集成调试；4、相关开发文档的整理与编写。岗位要求：1、熟练掌握JavaScript与CSS技术，至少2年以上Web前端开发经验；2、熟练掌握HTML、CSS、XHTML、XML等编写技能；3、精通jQuery，能自行编写基于jQuery的各种插件；4、熟练掌握常用前端框架中的一种或多种，如AngularJS，Vue，avalon，Kendo UI；5、熟悉Mvvm框架设计，对双向绑定机制有深入了解。6、有web后端开发经验者优先,1.0,1.0,1.0,1.0,0.0,1.0
22,Web前端开发工程师,前端开发,6250.0,流光星际（湖北）科技有限公司,恩施,0.0,大专,收到面试通知后请再次认真浏览本招聘信息要求及办公司介绍后按以下说明参与面试，应聘者携带本人身份证、个人简历、典型作品案例应聘地点：湖北省恩施市舞阳坝街道金子坝柑子槽小区2期4巷74号-绿庄建设5楼应聘流程：审核证件———面试交流（简历-作品）——进入试用工作要求:1、工作经验2年以上2、熟练使用HTML5+CSS3以及vue框架，熟悉uni-app者优先3、有作品者优先4、再次敲黑板：招聘会vue的小伙伴。另愿意学习的小伙伴我们愿意提供学习帮助和指导，学习期间工资照算。附：上班时间：早上8:30-12:00  下午2:30-6：00月选休4公司地点：湖北省恩施市，外地员工来恩施工作的车费由公司承担，（试用期通过成为正式员工后的***个月的工资一同发放。）员工福利：五险，管吃管住，高薪，定期体检，7小时工作制！ 办公设施：全新I7 8700+GTX1660+500G固体硬盘。恩施市拿此配置电脑来敲代码绝对是凤毛麟角。三餐伙食：包三餐，除早餐外，中下午10个菜左右，荤素搭配。掌勺的大师傅人超好，是恩施当地从业十余年的专业土家族厨师。想吃什么跟大师傅讲。职能类别：										Web前端开发																			软件工程师									关键字：webvueuniappvue框架,1.0,1.0,1.0,0.0,0.0,0.0
23,Web前端开发工程师,前端开发,12500.0,软金商贸（深圳）有限公司,深圳,3.0,大专,、熟练运用Web前端技术，包括XHTML、XML、CSS、JavaScript、jQuery、Ajax等；2、熟练使用VueJS开发，具有原生APP混合、纯H5和PC三端至少2端的前端开发经验。熟悉主流框架React、Angular其中一个；3、对浏览器兼容性、前端安全防范、响应式布局有实践经验；4、熟悉模块化开发，以及MVC、MVVM等开发模式；5、熟悉ES6/ES7标准，熟悉Less/Sass等；6、了解nodejs、npm，熟练使用webpack；7、有很强的自学及研究能力、良好的学习和沟通能力，对技术有激情和追求；8、有消息推送和长连接处理经验可以加分。9、有互联网公司经验；10、全日制统招本科，计算机相关专业毕业；11、经验不能低于2年；12、跳槽太频繁不接受；待遇：10-15K1、购买社保2、法定节假日带薪休假（包括年假、婚假等）3、除基本工资外，每月还定期进行绩效考核评比并发放绩效奖金，另有年终奖及其他多项奖励； 4．公司已建立完善的绩效考核体系，优秀员工每年定期有评级晋升加薪机会。,1.0,1.0,0.0,1.0,0.0,1.0
24,前端开发工程师,前端开发,9500.0,火眼科技有限公司,重庆,3.0,本科,岗位职责：1、 开发文档的编写；2、 参与软件系统需求调研和分析，参与软件设计方案撰写；3、 配合UI设计师的设计图制作HTML页面，可以轻松应对结构复杂的html 页面编码工作；4、 确保多浏览器页面的兼容性；5、 协助测试工程师完成软件的测试以及系统交付工作，对项目实施提供支持 ；6、 领导安排的其他工作。任职要求：1、有两年以上的前端开发工作经验；2、熟悉css和css3，熟悉html的dom结构，快速完成html页面；3、熟悉原生javascript，熟悉主流框架：jquery，Bootstrap ；4、熟悉vue或react前端框架的开发，熟悉W3C 标准和各主流浏览器在前端开发中的差异；5、良好的编码习惯，勇于承担工作压力，具备良好的责任心和团队合作能力；6、对于在前端开发性能优化，快速开发页面有自己想法的优先考虑。,0.0,1.0,1.0,1.0,0.0,1.0
25,高级前端开发工程师,前端开发,17500.0,广州广大通电子科技有限公司,广州,3.0,本科,、参与前端基础工具及框架的设计与实现3、对具体的产品进行性能优化，实现良好的页面加载、执行和渲染4、配合后台工程师一起研讨技术实现方案，进行应用系统的优化及整合5、完成项目文档的编写工作任职要求：1、3年以上Web前端开发经验，至少完整经历过一个产品的开发、上线、维护工作，对Web开发有整体认识2、精通JavaScript，熟悉常见的前端框架3、精通ES6，对前端工程化有一定了解，熟练掌握webpack/git/npm/Grunt/Gulp等构建工具的使用和配置4、掌握HTML、css等前端相关技术，熟悉LESS、SASS5、能对具体的产品进行性能优化，实现良好的页面加载、执行和渲染6、拥有良好的主动性与推动力，优秀的分析问题和解决问题的能力职能类别：										其他																			软件工程师									关键字：前端架构,1.0,1.0,1.0,1.0,0.0,0.0
26,前端开发（页面构造+切片））,前端开发,7000.0,湖南新环境房地产经纪连锁有限公司,长沙,0.0,大专,"【工作职责】1.与设计师、产品工程师紧密工作在一起,实现产品前端ui和交互方面的开发需求，确保不同平台、设备上具有优秀的用户体验；2.能充分理解项目需求和设计需求，具有一定研发精神，能解决各种未知问题；3.与团队成员分享经验和新技术，帮助团队成长。【职位要求】1.聪明，计算机基本功扎实，精通Javascript、AJAX、HTML、CSS等技术；2.能够写出高性能、高可维护性的“优美”的代码 ；3.成功开发过中大型Web应用程序；4.了解一门服务器编程语言如python/php等；5.熟悉各种浏览器平台的特性，能够很好地解决兼容问题；6.工作经验一年以上。",1.0,1.0,1.0,1.0,0.0,0.0
27,Web前端开发工程师（南通）,前端开发,7000.0,上海琪邦国际货运代理有限公司,南通,1.0,无,"职位描述：1.熟练掌握css＋div的运用与制作，熟悉HTML/CSS/javascript等并能熟练手工编辑修改HTML源代码，熟悉网站建设的流程和网页设计制作流程；2.精通Photoshop,Flash,Dreamweaver等网页设计美工软件；3.具有良好的创意设计能力，对色彩敏感，具有把握不同风格页面的能力；4.具有团队合作精神、敬业精神，细致专注，学习能力强，能承受工作压力；5.1年以上网页设计实际工作经验；工作职责：1.配合技术部完成客戶网站的开发和制作2.负责客戶网站规划建设和日常维护更新",0.0,1.0,1.0,1.0,0.0,0.0
28,Web前端开发工程师,前端开发,5000.0,重庆北开科技有限公司,重庆,1.0,无,"职位信息：1、与项目经理协作,分析并给出最优的前端结构解决方案和效果实现;2、负责项目前端页面以及所有js的开发及维护；3、负责协助设计、后台开发人员配合完成项目调试及修改；4、协助完成项目的测试、系统交付工作，对项目实施提供技术支持 职位要求1、1年以上前端开发经验，互联网相关从业经验者优先；2、熟练掌握Javascript、ES6，熟练掌握vue.js、react或者angular，精通者优先；3、熟练使用各种调试、抓包工具,能独立分析、解决和归纳问题4、具有性能优化经验，熟悉前端自动化和工程化，熟练使用Git。对前端性能优化、解决多浏览器兼容性问题有丰富的经验和案例；5、有GIS项目开发经验优先；6、对用户体验、交互操作流程、及用户需求有一定了解，有独立的审美观。",0.0,0.0,0.0,1.0,1.0,0.0
