,职位名称,职位名称关键字,职位薪资,公司名称,地区,工作经验,学历要求,职位描述要求,Web,Css,Html,Javascript,Js,Jquery
691,Web前端开发工程师,前端开发,12500.0,成都盈客网络科技有限公司,成都,5.0,本科,"岗位职责：1. 根据产品需求，给出最优的页面前端结构解决方案，并设计与实现前端框架；2. 负责公司核心产品各业务模块前端代码开发；与产品经理合作，以持续改善公司产品的用户体验；3. 与产品经理及UI设计师充分沟通用户UE需求，并根据效果图Axure原型输出WEB原型；页面的制作（html5+css3+JS），与后台开发工程师配合完成前端和后台的整合；4. 并负责系统页面优化，解决跨浏览器及版本的兼容性问题；性能调优；5. 开发针对公司产品和技术特点的前端开发框架和组件库；6. 指导并组织初中级Web工程师，共同完成交付工作；能够带领其它前端一起成长，定时做技术分享。任职要求：1. 本科学历及以上（条件优秀者可放宽），计算机相关专业毕业；2. 4年以上前端开发经验，有完整的组织前端开发项目管理经验或者出任前端开发技术负责人,项目经验至少三个以上；3. 精通主流前端框架(Vue/React/AngularJS)至少一种，了解其核心功能的实现原理；4. 对用户体验、交互操作流程及用户需求有一定了解；注重用户体验，不断重构优化代码；5. 有技术团队管理经验，能够组织并管理好团队，拥有酒店、旅游、用车类产品开发和管理经验优先；6. 对第三方支付（支付宝、微信）、百度地图接口有开发经验优先；7. 对微信公众平台接入及管理有实践经验者优先；8. 有Apicloud、Dcloud、Appcan使用经验，并且有上架应用的开发者优先。",1.0,1.0,1.0,0.0,1.0,0.0
692,Web前端开发工程师,前端开发,9000.0,广州市时尚商业城有限公司,广州,0.0,无,岗位职责：1、负责公司移动端、WEB端框架设计、架构升级、研发2、根据需求，分析并实现最优的页面前端解决方案。3、负责前端页面功能的开发与后期维护，持续改善用户体验。岗位要求：1、有较好ES6基础和扎实的JavaScript基础，对前后端分离开发、Web语义化等有深刻理解；2、熟练使用React、Vue、Angular中一种或多种相关技术栈；3、熟悉W3C标准，熟悉HTML5；4、至少会一种以上CSS预处理语言，如LESS、SASS、STYLUS 等；5、熟悉 Node 开发环境，至少能熟练使用至少Gulp、Webpack、Grunt等构建工具中的一种；6、良好的项目开发规范意识；7、了解Http协议、本地存储、socket网络编程优先；8、良好的沟通能力、良好的团队合作精神。,1.0,1.0,1.0,1.0,0.0,0.0
693,Web前端开发,前端开发,9000.0,江苏永谐文化传媒有限公司,南京,3.0,大专,、根据产品设计文档和视觉文件，利用HTML5，Javascript相关技术实现web端的界面效果、交互和功能；2、基于HTML5.0的标准进行页面制作，编写可复用的用户界面组件；3、负责分析和解决前端遇到的各种技术、性能、跨终端兼容问题4、配合完成Web项目迭代，优化和提升用户体验；5、配合后台开发人员实现产品界面和功能与后台的交互；6、参与公司项目开发规划，提出前端设计解决方案；7、写过响应式、H5网页，写过APP内嵌网页者优先；任职要求：1、3年以上前端工作经验；2、 精通HTML5/CSS3/javascript/vue等前端开发技术，能独立使用以上技术开发网站前端；3、熟悉iOS/Android移动平台Web开发技术标准，对Android与iOS等不同平台的html5页面适配充分了解；4、熟练使用Ajax、XML、JSON、原生JS等相关技术。使用过jquery、ext、Bootstrap等js框架的至少一种；,1.0,1.0,1.0,1.0,1.0,1.0
694,Web前端开发工程师,前端开发,12500.0,尚科博文（北京）教育咨询有限责任公司,北京,3.0,大专,计算机、通信、电子等相关专业大专以上学历2. 熟练掌握HTML5、CSS3、JavaScript，熟悉nodejs，了解php3. 对React、Redux 以及周边组件有深入理解，有实际开发经验者优先4. 熟悉移动WebAPP开发、跨平台、UIWebView、Webkit， 有react native开发经验优先5. 熟悉微信小程序优先6. 工作认真、严谨，主动的学习和协作能力,0.0,1.0,1.0,1.0,0.0,0.0
695,Web前端开发工程师,前端开发,5500.0,合肥同创培朗教育科技有限公司,合肥,2.0,大专,"、负责公司平台、ERP、CRM、OA等产品前端开发，并配合后端的开发 ；2、根据需求实现页面交互效果 ；3、基于HTML5/CSS3等开发经验参与项目研发和技术研究工作。任职资格：1、专科及以上学历，2年以上前端开发经验;2、对Javascript面向对象编程具有深入的了解；能够使用Javascript合理构建较为复杂的页面逻辑;3、熟练运用一种或多种主流开源框架或工具，如angular，vue.js，node.js，webpack，bootstrap等;4、熟悉W3C标准，熟悉HTML（包括HTML5），CSS（包括CSS3）,对表现与数据分离、web语义化等有深刻理解;5、扎实的编程基础，良好的编码习惯;6、工作主动积极，具备良好的自律性和自我驱动力。待遇福利：1、试用期5000元，转正6000元。（1）公司福利：养老保险、医疗保险、失业保险、工伤保险、婚假、产假、年假、团队聚餐、多项激励方案、享受带薪假期！（2）培训：免费带薪培训体制：岗前培训、业务能力培训、管理能力提升培训、户外拓展培训等。3、法定假日、超长年假放假休息（15-20天），传统节日、年假发放礼品。4、上班时间：周一至周五 上午9：00-12:00 下午14:00-18:00（7小时工作制）职能类别：										Web前端开发									关键字：JavascriptHTMLCSS",1.0,1.0,1.0,1.0,1.0,0.0
696,前端开发工程师,前端开发,15000.0,上海密尔克卫化工储存有限公司,上海,0.0,无,"参与公司各项目中的前端功能设计、开发和实现；2使用前端技术，创建用户友好、符合标准、跨平台及跨浏览器的应用，促进产品易用性改进和界面技术优化；3与后端开发人员配合，高质量完成前端开发工作；4产品性能优化以及迭代。任职要求：                                                                                     1、3年以上H5/JS开发经验，能独立进行微信小程序开发，计算机及相关专业；2、精通HTML,CSS,javascript，响应式页面设计等前端技术，熟悉前端模块化；3、熟悉vue.js、jQuery等框架的一种或多种；4、熟悉ES5/ES6，Sass等技术;5、掌握AJAX/XML/JSON等网络通信技术和数据交换格式；掌握HTTP/TCP/IP互联网通讯协议；6、熟悉B/S WebApp前端产品开发，熟悉B/S MVC开发，编写符合W3C标准、兼容多种浏览器的网页产品；7、良好的代码书写风格；有良好的编码习惯，代码风格清晰,简单,保证运行效率；有解决问题、钻研新技术的兴趣和能力，善于交流和表达",0.0,1.0,1.0,1.0,1.0,1.0
697,Web前端开发工程师,前端开发,5000.0,成都昆朋新能科技有限公司,成都,0.0,大专,"岗位职责：1、负责公司WEB项目开发工作；2、负责公司现有项目维护工作；3、参与系统设计及相关文档编写。岗位要求：1、大专学历，相关专业毕业；接收应届毕业生。2、熟练使用JAVA,Spring Rest；3、熟悉JS,H5,CSS及VUE；4、了解REST API设计；5、思路清楚，有基本的编程素质， 有良好的表达与沟通能力 ；6、通信、计算机、软件、电子信息专业优先。",1.0,1.0,0.0,0.0,1.0,0.0
698,前端开发工程师,前端开发,5250.0,广州升腾网络科技有限公司,广州,2.0,无,"前端应用的代码编写工作：负责详细设计、编码、测试工作；2.对重大质量问题，存在的技术难题，以及运行中发现的关键问题/多发问题进行攻关，与团队其他成员一起及时解决项目开发过程中跨前后端的技术难题；3.对代码质量和代码安全负责，确保所编写代码的健壮高效；项目运行的维护和支撑；4.完成项目负责人安排的其他任务。 任职要求：1.计算机相关专业，有3-5年以上开发工作经验，能独立完成上述的任务，有从事过大型系统开发设计经验者优先考虑；2.熟练掌握H5、CSS、JavaScript等相关开发技术，熟悉React/Ant Design/React Native/微信小程序等开发技术及框架；熟悉TCP/IP协议等网络协议，能够独立配置网络环境并解决实际中出现的故障；3.较强的逻辑思维能力，具备一定的系统分析能力，有良好规范编程的习惯和文档编写习惯,具备良好的团队意识。4.有良好的学习能力，沟通能力和领悟能力，工作效率高，能够承受工作压力；5.有良好的团队合作意识，耐心，诚恳，有强烈的责任心和积极主动的工作态度。",0.0,1.0,0.0,1.0,0.0,0.0
699,Web前端开发工程师,前端开发,7500.0,深圳阳光整形美容医院,深圳,3.0,大专,"大专以上计算机专业，1年以上web前端开发经验2.熟悉html5，CSS3、JavaScript网页前端技术，熟悉一门前端常见js框架，如jQuery3.js、css基础功底扎实,能够熟练的手写符合W3C规范、简洁、有效的web前端代码4.熟悉各种主流浏览器，对CSS和JavaScript不同特性的兼容性，并有相关问题解决经验5.具有良好的团队协作精神，较强的专业知识和新兴技术学习能力，乐于分享和沟通工作职责：1.负责内部系统以及微信端二次WEB前端开发；2.参与后端服务器语言交互；3.钻研各种前沿技术和创新交互，增强用户体验、开拓前端能力边界。",1.0,1.0,1.0,1.0,1.0,1.0
700,前端开发工程师,前端开发,11500.0,上海法辰电子科技有限公司,上海,3.0,本科, 参与项目、产品需求分析与设计、负责前端架构设计和开发工作。2. 负责公司产品PC端和移动端的前端开发，实现业务功能和交互效果。3. 产品的前端交互式效果实现、兼容多个浏览器版本、独立实现前端的全部功能。4. 优化前端代码和前端代码质量。5. 持续改进产品的易用性和用户体验。任职要求：1. 计算机相关专业，1~3年前端编程经验，精通h5、css、js、jQuery、bootstrap、Ajax等。2. 利用h5相关技术开发移动平台的web  app前端页面。3. 具有良好的团队合作精神，工作认真、虚心好学、沟通能力良好。 4. 有OA开发经验者优先。,1.0,1.0,0.0,0.0,1.0,1.0
701,前端开发工程师,前端开发,10500.0,深圳市赛尔美电子科技有限公司,深圳,5.0,本科,"需要您来完成：1.负责web前端页面开发、维护和优化工作；2.负责页面相关接入层开发；3.负责前端架构建设，公共组件的设计开发；4.微信小程序/H5开发。希望您是这样的：1.本科及以上学历，三年以上前端开发经验；2.熟练掌握HTML5、CSS3、JavaScript、ES6等；3.熟练使用至少一种JS框架，熟悉Vue或者Angular、Reactjs等，掌握其原理，能独立开发常用组件；4.熟练使用前端自动化构建工具，熟悉Webpack,对前端工程化与模块化开发有一定了解，并有实践经验；5.有weex/reactNative开发经验者优先；6.有激情有责任心，良好的沟通表达能力和团队协作能力；7.观端正、人性积极、孝顺父母、烟民***。***此岗位为子公司深圳铂岚科技所招聘，联系时招聘人员会说明，请知悉***",1.0,1.0,1.0,1.0,1.0,0.0
702,前端开发工程师,前端开发,8000.0,重庆鸿巨网络科技有限公司,重庆,3.0,大专,"岗位职责1、精通小程序开发,熟悉微信各种开发环境和规则【重点】；2、根据设计文档或需求说明完成代码编写、调试、测试和维护工作；3、与后端工程师协作完成前端相关需求，追求更好的用户体验，开发通用组件提高团队研发效率4、有良好的编写代码习惯，熟悉主流前端框架，对代码优化、兼容性有深入研究任职要求：1、精通各种Web前端技术，可手写高质量JavascriptHTML/CSS代码；，能够独立完成从设计图到UI切图到html代码的编写，有良好的架构，并在设计的过程中充分考虑到后台的编程；3、精通前端代码性能调优，熟练使用Firebug、YSlow、YUIcompress等工具；4、精通小程序开发；6、对新技术新知识敏感，乐于学习，有较强的学习和吸收能力；7、良好的沟通能力和协调能力，具有团队合作精神；8、工作敬业，责任心强，能够按照规定的工作流程开展工作；积极主动，发现问题及时提出意见和建议。",1.0,1.0,1.0,0.0,0.0,0.0
703,Java web前端开发助理,前端开发,3750.0,大连至简信息技术有限公司,大连,0.0,大专,岗位职责：1、负责协助开发人员开发网站前台功能及后台功能系统；2、负责网页切图，采用DIV+CSS布局制作静态网页，兼容IE6、IE7、IE8FF浏览器；3、开发基于HTML、HTML5技术的可灵活定制、可扩展的前端UI组件4、优化前端架构，提高系统的灵活性和可扩展性5、开发、维护、扩展前端代码框架二、任职资格：1、大专及以上学历，软件工程、计算机等专业优先，有相关基础的其他专业亦可，逻辑思维能力强的理工科专业学生亦可；2、 沟通能力佳，有团队意识。3、热爱计算机软件开发行业；4、有良好的工作态度和团队合作精神；5、优秀的应往届毕业生可适当放宽条件6、善于学习和总结分析，有良好的工作态度和团队合作精神；三、待遇福利及工作时间： 早9-晚6 双休 法定假日休息，带薪年假，五险一金，有宿舍。,0.0,1.0,1.0,0.0,0.0,0.0
704,Unity 3D/小程序游戏前端开发,前端开发,15000.0,广州安悦网络科技有限公司,广州,3.0,大专,岗位职责：1、根据开发要求，使用LayaAir等相关引擎独立开发各类小游戏；2、负责游戏中的功能模块开发，包括UI实现、动画特效、逻辑开发、性能优化等；3、与项目组策划、美术人员共同讨论开发需求及设计游戏实现细节；4、发布小游戏到平台，以及后期的维护和版本迭代。岗位要求：1、大专及以上学历，2年以上游戏开发经验，有微信小游戏/H5游戏开发经验者优先考虑；2、熟悉LayaAir、Unity3D、Cocos2d-x/JS等其中一款游戏开发引擎，有LayaAir引擎经验优先考虑；3、熟悉、了解UE4引擎的优先考虑；4、具备良好的编码习惯，命名规范、结构清晰、逻辑性强；5、对游戏资源优化、内存及性能优化、代码混淆有研究，熟悉常用游戏算法； 6、热爱游戏开发，善于学习总结，乐于分享，具备团队协作精神，有抗压能力。,0.0,0.0,0.0,0.0,1.0,0.0
705,前端开发工程师,前端开发,7000.0,青岛元启智能机器人科技有限公司,青岛,3.0,本科,项目设计与规划       1.参与系统架构设计和关键技术分析，并负责完成核心技术代码的开发；2.参与项目需求分析、流程设计，研讨技术实现方案 ；   页面设计1.了解现在主流的设计风格；2.负责项目网站或移动端页面设计；构建与开发1.负责公司现有项目和新项目的前端修改调试和开发工作；2.使用HTML、CSS熟练地进行页面构建与维护；3.熟练使用JS完成交互效果的实现；4.页面通过标准校验，兼容各主流浏览器；项目管理1.与后端开发团队紧密配合，确保代码有效对接，优化网站前端性能；2.完成新技术领域的研究和探索；团队管理1.做为新员工的指导老师，指导新员工完成各项开发工作；2.培训新员工的相关技术能力；技术管理1.保证项目或产品的稳定运行，负责解决项目中遇到的问题，完成性能调优；,0.0,1.0,1.0,0.0,1.0,0.0
706,前端开发工程师,前端开发,12500.0,深圳步步为饮网络科技有限公司,东莞,5.0,大专,岗位描述：1、微信公众号商城开发；2、微信小程序开发；3、其他前端功能开发；岗位要求：1、本科以上学历，两年以上前端开发经验；（能力突出者本要求可放宽）2、熟练掌握并使用JavaScript、CSS3和HTML5。掌握ES6、SASS、gulp、webpack等前端技术；3、熟悉React、Vue或任一主流框架；4、了解不同平台和不同浏览器的差异，有微信公众号或小程序开发经验优先；5、对后端技术和数据库有一定了解优先；6、学习能力强，能阅读英文文档；7、熟悉版本控制软件（SVN或git）。,0.0,1.0,1.0,1.0,0.0,0.0
707,前端开发工程师,前端开发,10500.0,凯杰（苏州）转化医学研究有限公司,苏州,0.0,无,、负责公司web平台和管理系统前端功能模块设计与开发； 2、负责与后端软件开发工程师和其他部们协作完成产品的开发工作； 3、负责对前端项目进行性能优化。 任职要求： 1、本科以上学历，计算机软件或相关专业优先； 2、精通HTML5、CSS3、JavaScript、ES6、AJAX、jQuery等前端开发技术，有三年以上跨浏览器开发经验； 3、熟练掌握至少一种主流前端框架Springboot、Bootstrap、Vue、AngularJS、或ReactJS等； 4、熟悉web前端性能优化，并对web安全有丰富的认识和经验； 5、熟悉web标准，对前后端分离、RESTful web service等有较深刻理解; 6、熟悉SVN、Git等代码管理工具； 7、良好的代码风格和较强的自学能力；8、强烈的责任心，良好的沟通表达能力和团队合作精神。,1.0,1.0,1.0,1.0,0.0,1.0
708,Web前端开发工程师,前端开发,9500.0,深圳有好软件有限公司,深圳,1.0,无,"岗位职责：1、负责应用系统的前端与开发；2、根据项目的具体要求，参与分析与系统设计；3、配合同事，进行项目优化、代码开发等。任职职格：1、有1-3年的工作经验，计算机软件等大专以上学历；2、熟悉html,Angular,css,javascript,jquery；3、懂点后端更佳；有asp.net经验优先；4、善于学习业务；5、有良好的工作习惯和职业操守；6、有较强的团队合作能力和沟通交流能力。",0.0,1.0,1.0,1.0,0.0,1.0
709,Web前端开发工程师,前端开发,7000.0,深圳云上推科技有限公司,深圳,0.0,无,岗位职责1、与交互设计师及视觉设计师协作，根据模型完成Web页面制作；2、配合后台开发人员实现产品交互界面；3、针对UI设计图能够进行切图，编写CSS规范，并形成CSS基础框架，精通跨浏览器的Web前端开发。任职资格1、3-4年Web开发经验，了解W3C相关标准；2、熟悉Web开发，html/css/javascript；了解Ajax、DOM等前端技术，掌握面向对象编程思想；3、熟悉前后端数据交互；4、精通各浏览器兼容性，保持页面美观统一，符合相关标准；5、具有良好的表达、沟通、学习及问题分析能力；6、具有良好的过程改善思维及能力；7、具有良好的代码注释及编程格式习惯；8、具有较强的团队合作精神、进取心和求知欲，热爱学习，勇于挑战。,1.0,1.0,1.0,1.0,0.0,0.0
710,前端开发工程师,前端开发,11500.0,浙江万明精配大数据科技有限公司,宁波,3.0,本科,、负责App的前端设计和开发；2、参与项目需求分析，负责前端系统架构设计；3、学习和研究新技术以满足产品的新需求。任职要求：1、2-3年移动端开发工作经验；2、掌握html/css、js、Angularjs、ionic、Vue、混合app打包等；3、有独立负责APP开发、发布、优化的经验；4、能提供完善的WebApp和混合App（JS方向）技术方案；5、有微信小程序、微信商城开发、H5开发经验者优先;上班时间：8:30—17,0.0,1.0,1.0,0.0,1.0,0.0
711,高级前端开发工程师,前端开发,27500.0,上海脉源企业管理咨询有限公司,上海,5.0,本科,岗位职责：1、参与团队分析产品需求、 产出技术方案及预估项目排期；2、参与客户端架构设计，方案制定；3、根据需求完成客户端开发；4、编写单元测试，在代码交付前进行完整的自测；5、定位并修复现有质量缺陷；6、按照项目需求进行相关产品的开发工作并保证需求开发的质量。任职资格：1、全日制本科及以上学历，计算机相关专业；2、5年以上前端开发经验，对 HTTP 协议有基本了解；3、有 Typescript 开发经验；4、了解 ECMA-262 标准；5、熟悉 CSS 标准；6、熟悉常见宿主环境API；7、熟悉任意一种数据库；8、阅读过任意一款开源框架源代码；9、对曾经使用过的技术方案的特性、局限性有一定了解；10、热爱技术，对web前端技术发展有强烈的兴趣，有良好的自学能力和强烈烈的责任心。,1.0,1.0,0.0,0.0,0.0,0.0
712,Html5前端开发/助理/双休,前端开发,5650.0,郑州海之角软件科技有限公司,郑州,0.0,中专,岗位职责:（全职）1、协助工程师web软件功能开发；2、服从公司的发展要求，认真学习和全面了解公司的相关情况和工作细节；3、协助公司基本项目的开发，熟练掌握公司所应用的专业技术；4、参与公司所用技术的优化和升级。任职资格:1、对软件开发有浓厚的兴趣，计划从事该行业稳定发展；2、有一定的逻辑思维，条理性强，热爱互联网行业；3、有团队精神，愿意虚心学习，能够协助工程师完成项目开发工作；4、吃苦耐劳，有一定的自我约束和控制能力，意志力坚强；5、计算机专业优先，html，css，js，h5框架，小程序。福利：底薪+奖金+补贴+五险一金+年底双薪+公司拓展旅游职位升迁机会：实习生/助理 -- 工程师 -- 高级工程师 -- 技术总监 -- 分公司负责人,1.0,1.0,1.0,0.0,1.0,0.0
713,前端开发,前端开发,5500.0,江苏长宏邮电设备实业有限公司,无锡,0.0,大专,"、1-2年以上相关经验，扎实的Java语言基础，有手机客户端界面编程经验；2、熟练掌握JQuery、Structs,Hibernate、mybatis、Rest Service、Spring Framework等前沿技术，使用过Netty、Mina等主流开源通信服务器框架;3、熟悉 DIV+CSS，有页面美化和设计经验优先考虑；4、熟悉SQL Server、Oracle、MySql、DB2数据库，有数据库优化能力者优先；5、在实际项目中能够根据系统总体设计完成功能模块设计、代码编写、单元测试等工作；6、具有较强的自学能力，能够承受一定的工作压力，迅速解决工作中遇到的实际问题，具有良好的团队合作精神和沟通能力；7、具有良好的代码编写和设计文档编写习惯；8、计算机专业、数学专业专科及本科相关以上学历；9、优秀应届生亦可。",0.0,1.0,0.0,0.0,0.0,1.0
714,前端开发工程师,前端开发,7500.0,广州昌松之家旅居服务有限公司,广州,2.0,大专,精通小程序、HTML5、JavaScript、JQuery、JSON、VUE、AJAX、HTML、XML、CSS等开发技术有2年以上前端应用程序开发工作经验，具备良好的沟通能力，有极强的自学能力及责任感，能够承担较强工作压力,0.0,1.0,1.0,1.0,0.0,1.0
715,应届WEB前端开发+双休,前端开发,5750.0,湖北省零度银色冰雪实业有限公司,武汉,0.0,无,公司可提供实习岗位，欢迎优秀应届毕业生投递简历职位描述：1、在工程师的帮助下负责软件产品的开发与维护；2、根据产品需求完成架构和模块设计、编码、测试、调试工作；3、能按照项目计划，按时提交高质量的代码，完成开发任务；4、改善软件的易用性，提升用户使用体验。5、对软件bug的修复，完成团队项目工作。福利待遇：1、周末双休，每天7小时上班时间，无夜班，不加班，2、大量有奖金项目可做，能力强者可不限量接受奖金项目，3、公司为员工购买五险一金，定期组织员工生日会、野外游玩等活动，提供良好的晋升机制，广阔的晋升空间。,0.0,0.0,0.0,0.0,0.0,0.0
716,web前端开发助理,前端开发,5000.0,河南六凹六物联网科技有限公司,郑州,0.0,大专,岗位职责：1.负责前端辅助开发工作，负责WEB应用的界面设计并根据效果图完成静态实现；2.良好的逻辑思维能力，了解网页制作的流程，了解HTML、CSS等网页制作技术；职位要求：1.、18-25岁，大专及以上学历，理工科专业，良好的逻辑思维能力；2.、负责前端辅助开发工作；3、对计算机感兴趣，有志于长期从事设计；4、学习能力强，有良好的沟通能力，有良好的团队合作精神，有责任心；除了极具竞争力的薪酬待遇，员工福利有：1、五险一金：养老保险、医疗保险、工伤保险、生育保险、失业保险、住房公积金。2、国家规定的各类假期。3、上下班班车，员工食堂（十余条线路，基本覆盖郑州市）。4、一流的办公环境：自建新风系统、室内羽毛球场、淋浴室、健身房、书吧、咖啡吧、员工休息室、娱乐室等。5、不定期组织体育类、文艺类、聚餐类等集体活动及公益性活动。,1.0,1.0,1.0,0.0,0.0,0.0
