,职位名称,职位名称关键字,职位薪资,公司名称,地区,工作经验,学历要求,职位描述要求,Web,Css,Html,Javascript,Js,Jquery
483,Web前端开发工程师,前端开发,15000.0,深圳惠临贸易有限公司,深圳,2.0,大专,大专及大专以上学历，相关工作年限3年以上。2、 精通JavaScript、HTML5、CSS等技术，熟悉ES6 ;3、 熟练运用主流的移动端JS库和开发框架，并深入理解其设计原理， 如Vue.js、ReactJS、Angular 等，有Vue.js实战经验的并有复杂应用场景的开发经验；4、 有移动端web app混合开发经验；5、 有前端架构、性能优化、稳定性等方面的实践经验优先；6、 对技术有强烈的进取心，具有良好的沟通能力和团队合作精神，优秀的分析能力和解决问题的能力， 具有一定的抗压能力。,1.0,1.0,1.0,1.0,1.0,0.0
484,Web前端开发工程师,前端开发,8000.0,蓝鸽集团有限公司,嘉兴,0.0,无,、熟练使用html、CSS、Javascript；2、熟悉jQuery框架，熟悉ajax请求；3、熟悉react、vue、Angular中的一种，能熟练使用react者优先；4、一年以上工作经验；5、良好的沟通能力、较强的团队合作意识、勤奋好学；6、具有良好的编程风格；岗位职责1、根据项目业务，搭建系统前端界面框架，开发前端页面，实现页面的动态交互；2、能根据需求独立完成开发与测试，确保性能、质量和安全；,0.0,1.0,1.0,1.0,0.0,1.0
485,资深web前端开发工程师,前端开发,10500.0,深圳市优威视讯科技股份有限公司,长沙,3.0,本科,"、使用现代化的前端框架，例如React,Redux等，追寻工程化实践和组件化、模块化，研究最新的前端技术并将成果应用于前端开发工作，服务于海外的用户；2、负责公司产品Web端、移动端的原型及功能设计和组件、模块的开发优化工作，负责组件框架的设计和研发；3、优化前端开发方式及协作流程，负责前端团队代码质量及开发技术标准及规范，负责产品相关文档撰写(包括逻辑流程、用例分析、原型、组件设计、详细设计) ；岗位要求：1、三年以上工作经验，计算机及相关专业本科以上学历；2、熟悉前端组件化、Node模块化；熟悉前后端通信原理，熟悉DOM、AJAX、Json，熟悉主流Javascript框架React、Express、Koa等，并有前端架构设计经验；3、精通JavaScript、HTML、CSS等技术，精通前端工程化开发流程与构建工具，如Gulp，Webpack等，至少有一个大型项目开发经验； 4、学习能力强，乐于钻研、创新并能付诸实施，对业界最新的前端技术和实现有浓厚的兴趣和深入的见解；有责任心，优秀的团队合作精神，良好的沟通表达和逻辑分析能力。",1.0,1.0,1.0,1.0,0.0,0.0
486,Web前端开发工程师,前端开发,3750.0,无锡辰达网络科技有限公司,无锡,1.0,大专,工作内容：1、负责PC和移动端网页的前端开发、交互、代码优化等；2、负责自己制作网页的测试，解决产品在不同浏览器、移动设备下的兼容问题；3、与设计人员、后台开发人员保持良好沟通。任职资格：1、大专及以上学历；2、基本功扎实，熟练应用jQuery，精通熟悉HTML5，CSS3，ES6等；3、熟悉模块化、前端编译和构建工具，深入研究应用过主流的前端框架，如angularjs，reactjs，vuejs等；4、有较强的学习欲望、学习能力和研究精神；5、具有极强的团队协作精神，具有团队发展规划能力。,0.0,1.0,1.0,0.0,0.0,1.0
487,Web前端开发工程师,前端开发,6000.0,福建省扬彬网络科技有限公司,福州,1.0,大专,岗位职责：1、负责公司项目的前端修改调试和开发工作；2、根据设计文档完成模块的前端开发（静态页面编写、数据绑定、JS编写），辅助完成系统集成测试与bug修改。3、负责移动端的前端架构框架、前端技术设计与实现；4、与后端开发团队紧密配合，确保代码有效对接，优化网站前端性能；5、负责网站前后台的修改和升级，根据业务需求开发，制作和程序修改；6、前端应用构建和后端数据的集成；7、持续优化相关产品的质量、性能以及用户体验。任职要求：1、精通Web前端技术(HTML/CSS/JavaScript/Ajax等)，熟悉主流框架、类库的设计和实现；2、了解JS语言特性，对JavaScript的面向对象、原型、模式设计等内容有深入的理解。可不依赖框架实现复杂业务逻辑。3、熟悉http，熟悉各种浏览器终端的兼容性，对Web前台的性能优化以及Web常见漏洞有一定的理解和相关实践。4、熟练掌握vue、angular、react等框架，但不依赖框架；5、了解node.js，了解nginx等Web服务器配置，了解Linux命令；6、能独立完成Web/Html5的开发，并兼容不同设备；7、逻辑思维清晰，具有团队合作精神，对业界的发展动态有比较密切的关注，有技术攻坚能力。8、1年以上前端开发工作经验，大专以上学历，计算机相关专业；,1.0,1.0,1.0,1.0,1.0,0.0
488,Web前端开发工程师,前端开发,10000.0,浙江飞戎机器人科技有限公司,嘉兴,3.0,大专,多年的前端开发工程师，对前端各种框架熟悉，能够带领团队完成前端的开发的工作。完成核心模块，熟悉微信小程序开发,0.0,0.0,0.0,0.0,0.0,0.0
489,前端开发工程师,前端开发,,成都甲乙方程科技有限公司,成都,3.0,大专,"任职要求：1、本科以上学历，1-3年以上的web前端开发经验，***有独立完成项目的经验。2、熟练掌握HTML、CSS3、JS、ES6、React Native等规范和技术；熟悉常见跨域、跨浏览器问题，了解必要的计算机网络协议；3、熟悉常见跨域、跨浏览器问题，了解必要的计算机网络协议；4、熟悉VUE、React、Angular、Backbone等至少一种前端框架； 5、对微信小程序的开发有所了解；6、了解各种浏览器兼容性, 有独立完整的交互式Web产品前端开发经验；7、对技术有强烈的进取心，具有良好的沟通能力和团队合作精神。8、本需求是***需求，周期是2-3个月，请悉知",1.0,1.0,1.0,0.0,1.0,0.0
490,Web前端开发工程师,前端开发,12000.0,上海昊沧系统控制技术有限责任公司,武汉,3.0,无,职位描述（工作内容和主要职责）：1. 参与产品的开发和业务实现2. 基于Vue.js完成web前端项目，进行性能优化3. 负责App相关H5页面开发4. 通过各种前端技术手段，提高用户体验并满足性能要求5. 与后台工程师深度交流合作，一起研讨技术实现方案，并落实为具体的开发工作职位要求：1. 计算机及其相关专业本科以上学历2. 有三年以上前端开发经验，有过前端架构经验者优先3. 精通ES6/H5/CSS3/SVG/Canvas等前端相关技术4. 熟悉主流前端开发框架，如Vue/React/Angular2，有Vue开发经验者优先5. 对模块化，组件化，前端工程化有所认识6. 对页面的用户体验、交互流程能提出自己的看法具备较好的沟通、理解、表达、逻辑能力、学习能力和执行力,1.0,1.0,0.0,0.0,1.0,0.0
491,高级前端开发工程师,前端开发,16000.0,浙江小兰智慧科技有限公司,杭州,3.0,本科,上班时间：09:00-17:30  周末双休 优质团队，工作氛围佳，完善的福利体系及晋升制度欢迎加入，随时来撩岗位职责：1、承担WEB前端核心模块的设计、开发工作；2、对公司的产品提出用户界面和用户体验方面的合理建议；3、实现页面特效、JS效果；4、维护及优化前端页面性能，优化交互体验；5、解决主流浏览器的兼容性问题，页面制作符合seo规范；任职资格：1、计算机相关专业，3年以上工作经验。2、较强的逻辑思维，干净整洁的编码习惯。具备独立开发能力，有微信相关开发经验；3、熟练掌握HTML5、CSS3、JS，并且能应对html和css带来的兼容问题；4、熟练使用JS框架，重度jQuery用户加分；5、熟练掌握流行前端框架，vue、react（必须）、Ant design(优先)等；6、css sprite等前端优化技术；7、了解httpstatus、restful； 8、加分项：解读过框架源码，熟练多框架，具备框架开发能力，有自己的网站，了解网站的所有配置，了解一种服务端语言。,1.0,1.0,1.0,0.0,1.0,1.0
492,WEB前端开发工程师,前端开发,11500.0,上海捷奥软件股份有限公司,南京,3.0,本科,我们拥有专业的团队我们具备良好的办公环境我们的薪酬体系具有竞争力和激励性我们提供多样化的员工福利我们拥有对个人发展极具成长性的工作平台和内容我们虚位以待，只需要您是：1、第一学历为全日制本科毕业或以上(软件工程、计算机、电子、通信、数学等相关专业)；2、至少拥有三年以上基于HTML5技术相关项目的开发经验；3、精通XHTML/XML、CSS，熟悉页面架构和布局，对表现与数据分离、Web语义化等有深刻理解；4、对HTML5、CSS3、Canvas等技术有一定了解，熟练使用less或sass进行前端开发；5、熟练使用jQuery、Bootstrap、React、Vue等至少一种JS框架，掌握其原理，能独立开发常用组件；6、沟通能力良好，有较强责任心，有大中型项目前端架构经历者优先；7、最好在面试之前提供Github、博客或者作品让我们先了解你。如果您符合以下条件，我们优先欢迎：1、熟悉银行业务或者有银行业系统开发经验；2、具备985或211学历者优先；3、3年以上前端开发。您需要做的是：1、负责前端界面构建，各类交互设计实现等；2、负责产品的前端开发，编写可复用的用户界面组件；3、持续优化前端体验和页面响应速度，并保证兼容性和执行效率；4、和后台工程师紧密配合，保证产品的用户体验及稳定性；5、具有较强的性能优化意识，并发挥积极作用；6、研究前端新技术，持续推进前端代码框架升级，不断提升前端产品体验。只要你有才能，只要你够努力，我们就能给你一片天地我们欢迎心怀梦想、不甘平庸的你加入！金融科技的江湖！等你来！,1.0,1.0,1.0,0.0,1.0,1.0
493,Web前端开发工程师,前端开发,10000.0,武汉市云链智慧区块链科技有限公司,武汉,0.0,无,"岗位职责：1、参与制定PC端WEB开发框架、核心功能开发；2、负责已有WEB系统的升级、维护；以及新系统的设计、开发；3、负责根据其他开发组提供的数据接口进行数据交互；4、负责软件代码的编写、调试及后期维护；5、按照项目需求进行相关产品的开发工作并保证需求开发的质量；6、负责PC软件集成、部署、发布等工作。任职要求：1、对界面设计，用户体验有深刻的理解，对视觉细节有高度的敏锐；2、精通HTML5、CSS/CSS3、Javascript，运用DIV+CSS+JS准确地完成HTML界面布局开发，还原UI设计并实现所需的动画效果以及交互效果；3、关注前端动态，至少非常熟练使用一种前端框架React,VUE其中一项；4、熟悉精通H5cssjsreact；5、性格开朗，能较快融入团队，具有良好的团队合作意识，能承受高压力，工作主动性好，效率高；6、大专以上学历，二年以上前端开发相关经验，有过大型网站或移动终端的前端设计和研发经验者优先。",1.0,1.0,1.0,1.0,1.0,0.0
494,高级前端开发工程师（项目部）,前端开发,14000.0,苏州犀牛网络科技有限公司,苏州,3.0,本科,岗位职责：1.负责产品设计的前端开发工作，能够熟练手写html/css/javascript；2.基于javascript框架的应用、项目开发、组件开发；3.配合产品经理/UI设计师完成网页页面的交互/效果/用户体验的实现，并持续改善用户交互体验4. 构建部门内部开发的js框架和前端规范；5.对前端技术的发展趋势保持关注，能不断学习业界新技术；任职要求：1.精通web2.0标准、html、css，熟悉掌握html5、css3，javascript，jquery、ajax、dom、xml、json等相关技术等；2、深刻理解web标准（w3c）、html语义化标签，对符合web标准的网站前端有丰富经验；3.确保重构的网页能兼容主流浏览器（ie6－11、firefox、chrome等）4、有一定的html css的架构设计能力，具有良好的css编写规范，设计过结构良好、可复用的网页模板。5、熟悉前端性能优化、用户体验、交互设计；6\熟悉Canvas和Sv6、有angularjs、bootstrap、nodejs、移动端等相关工作经验的优先。,1.0,1.0,1.0,1.0,1.0,1.0
495,高级前端开发工程师,前端开发,13500.0,徐州金蝶软件有限公司,武汉,3.0,本科,负责整个平台前端框架搭建，关键技术预研，难点问题攻克；2.完成核心代码及研发调试、测试工作以及技术文档的撰写；3.根据产品设计文档、产品原型，快速给出解决方案；4.可利用HTML5、CSS3等相关技术进行页面制作，确保页面制作的样式、布局与产品原型一致，并配合后端完成开发工作 ；5.与团队保持良好的沟通，帮助团队其他成员解决技术问题、及相关技术分享。岗位要求： 1.计算机或相关专业本科及以上学历，三年以上前端开发经验； 2.精通VUE，并熟练掌握React、Angular、Note等主流前端框架之一进行开发，熟悉设计思想，具备独立开发组件能力； 3.能对element-UI组件进行自定义开发；4.有政务相关项目或大数据可视化相关开发经验者优先。,0.0,1.0,1.0,0.0,0.0,0.0
496,前端开发工程师（五险一金、双休）,前端开发,11500.0,武汉睿瀛新媒文化传播有限责任公司,武汉,2.0,本科,、实现产品前端UI和交互方面的开发需求，确保不同设备上具有优秀的用户体验；2、能充分理解项目需求和设计需求，具有一定研发精神，能解决各种未知问题；3、有问题多沟通，帮助团队成长。岗位要求：1、熟练掌握es5/6/7，html5，css3；能独立开发pc页面、微信小程序内嵌h5页面；2、掌握ajax、axios等http库创建交互式网页应用的开发技术；能熟练处理json数据； 3、掌握vue框架，有vue项目经验优先。4、计算机软件相关专业。5、有电商小程序项目经验者优先。,0.0,1.0,1.0,0.0,0.0,0.0
497,Web前端开发工程师,前端开发,13500.0,上海易立德信息技术股份有限公司,佛山,3.0,本科,此项目是与美的合作，工作地点在佛山顺德美的总部；岗位职责：     1.负责产品的前端代码开发、页面重构以及交互设计逻辑处理。      2.开发高性能、高兼容性的前端代码，完成脚本通用类库、框架、UI控件的编写，并形成文档。      3.与产品、UI设计、后台开发人员等协作实现产品功能及评估、优化网站前端性能.岗位要求：①、 3年以上前端开发经验学历（本科）；②、 熟练掌握HTML5、CSS3、JavaScript;JS基础扎实，掌握ES6③、 熟悉W3C标准与ES规范，熟悉Web语义化④、 熟练掌握盒模型、常用布局以及浏览器兼容性⑤、熟练使用Vue框架，掌握其原理，能独立开发常用组件，能独立开发vue项目⑥、 熟练使用各种调试、抓包工具，能独立分析、解决和归纳问题；相关福利：长效激励：1）对表现优秀员工，公司将提供优秀人才股权激励计划；2）年度调薪；奖 金： 1）工龄奖鼓励；             2）优秀员工、奋斗者等提供奖金激历；             3）表现优秀者有年终奖终；             4）担任技术导师、讲师奖励。五险一金：五险一金：入职当月购买：养老、失业、生育、工作、医疗保险和住房公积金，补充商业险；年度体检：公司每年统一组织全面体格检查；带薪假期：享受法定假11天，年假5-15天，全薪病假5天，产假，婚假等劳动法规定的各类带薪假；培   训：公司定期和不定期举行相应的技能培训、管理能力培训、技术分享会，学习资料定购，培训费用报销；休闲娱乐：不定期举行相关茶话会，下午茶、篮球比赛、羽毛球比赛、部门活动等； 企业活动：庆生会，拓度，中秋灯迷会，传统节日礼品，年度拓展，春节晚会。,1.0,1.0,1.0,1.0,1.0,0.0
498,前端开发工程师,前端开发,14000.0,广州碧软信息科技有限公司,广州,3.0,大专,岗位要求：1.计算机专业，3年以上相关工作经验，全日制大专及以上学历，本科优先；2.精通HTML/CSS/JavaScript等前端技术，能轻松写出符合W3C标准、兼容主流浏览器的代码；3.熟悉HTML5，CSS3，ES6的新特性，有丰富的H5开发经验；4.熟悉Angular、avalon、Vue、React等前端框架，有实际项目经验；5.熟悉gulp、Grunt等构建工具；6.有丰富的前端插件使用经验，例如webUploader、ECharts等；7.有独立完成复杂前端模块的设计与实现的经验，有一个以上复杂的前端开发案例优先；8.良好的沟通合作能力，能够承担压力，严谨认真的工作态度；9.有Node.js项目经验者优先考虑；有长期维护的个人技术博客或github者优先考虑,0.0,1.0,1.0,1.0,1.0,0.0
499,Web前端开发工程师（微信小程序）,前端开发,8000.0,杭州拓麦科技有限公司,杭州,1.0,本科,"岗位要求* 扎实的移动前端基础（JavaScript, CSS, HTML）* 熟悉微信生态及微信小程序生态（首要）* 熟悉网站性能优化，页面体验优化，解决浏览器兼容性* 熟悉以及深入理解一个主流的前端框架（React， Vue，Angular）* 良好的逻辑思维能力和团队合作能力，有快速分析和解决问题的能力 * 计算机相关专业",0.0,1.0,1.0,1.0,0.0,0.0
500,前端开发工程师,前端开发,26250.0,深圳华锐金融技术股份有限公司,深圳,3.0,本科,职责描述：1. 根据UE/UI设计及需求文档，负责WEB页面设计与开发；2.配合后端进行前后端接口设计；3.利用JS、CSS、HTML5等技术完成前端开发工作；4.负责多浏览器兼容处理，多分辨率屏幕适配工作。任职要求：1.计算机类相关专业本科及以上学历，3年以上WEB前端开发经验；2.具备团队合作精神，有较强的责任心；3.熟练掌握Html5、CSS3、Javascript、Ajax，熟悉sass、less及jquery。4.熟悉Vue/Angular/React/seajs等模块化开发方式，至少精通其中一种框架开发；5.熟悉常见的WEB前端优化法则，注重代码质量；6.熟悉后端开发语言（JAVA/C++等），有Vue项目经验优先；7.有开源项目/技术博客，请在简历中附上。,1.0,1.0,1.0,1.0,1.0,1.0
501,前端开发工程师（实习）,前端开发,5250.0,上海挚游网络科技有限公司,上海,0.0,无,"、有Web应用开发经验者优先考虑；2、精通HTML5/CSS3/JavaScript/Ajax/Jquery的开发3、熟悉react,Angular主流前端框架。4、对数据结构以及后台语言Java等有简单了解；5、良好的沟通与表达能力，思路清晰，有强烈的责任心和创新意识，业务逻辑理解与分析能力强。6、具备react/redux/webpack/ES6开发经验，熟悉、vue者优先考虑。7、一周能实习4-5天优先考虑。",1.0,1.0,1.0,1.0,0.0,1.0
502,前端开发工程师,前端开发,15000.0,上海速连信息科技有限公司,上海,5.0,本科,任职要求：1.       大学本科及以上学历，计算机及相关专业毕业，三年以上工作经验；2.       熟悉Vue框架，熟悉HTML、CSS、JavaScript等前端相关技术；3.       具有良好的沟通能力及团队意识。工作认真负责、踏实肯干、积极主动。 加分项：1.       精通原生JavaScript优先；2.       有Vue单页项目实现经验优先；3.       了解Ajax，有项目经验优先；4.      有电子政务项目经验者优先。,0.0,1.0,1.0,1.0,0.0,0.0
503,Web前端开发工程师,前端开发,12500.0,沈阳中科博微科技股份有限公司,沈阳,0.0,无,岗位职责：1、参与上位机软件项目的需求调研、分析、评审等工作；2、参与项目或产品的前端设计开发工作；3、参与项目或产品的前端技术设计与研发，进行代码的编写、调试、测试工作。任职条件：1、本科或以上学历，计算机、自动化、电子信息、通信、艺术设计等相关专业；2、5年以上前端开发经验，精通JavaScript、HTML5，精通Svg、Canvas等浏览器端图形编程技术，至少掌握BootStrap、Jquery、Vue中的一种前端框架，熟练使用CSS3动画或SVG动画，能够解决不同浏览器的兼容性问题。3、具备基于浏览器的图形编辑器开发经验；有Mxgraph、Hightopo相关开发经验优先考虑；有HMI软件、工控组态软件的前端开发经验者优先考虑；4、有Hybrid App前端开发经验和App上线经验优先考虑。5、熟练使用svn或git代码管理、项目管理、Bug管理、测试管理工具； 6、具备一定的英文读写能力，流利阅读英文技术文档；7、沟通协调能力强，工作严谨、责任心强、抗压能力强、具备高度保密意识。,0.0,1.0,1.0,1.0,0.0,1.0
504,Web前端开发工程师,前端开发,10000.0,广州康睿智能科技有限公司,广州,3.0,本科,"负责公司产品的前端开发、页面架构设计，与后台工程师协作完成数据交互，动态信息展示；   依据已有项目进度与需求，能按时、准确完成所需功能开发；   负责产品的交互效果开发，并能使用JS封装良好的前端交互组件，提高团队协作效率；  不断检验并优化网站前端页面性能，提高页面访问效率；   较强的自学能力，对新兴技术敏感，乐于学习并使用新技术。熟悉web前端技术，精通HTML5、CSS3、JavaScript等技术，熟悉react, vue, angular等流行框架的一种； 注重代码规范，语义化编码，结构清晰，效能高；熟悉SEO结构规范；  熟悉移动端页面开发，交互效果实现；熟悉手机端各种浏览器特性及开发规范；   熟悉模块化工程化开发，如Reqire JSSea.js，熟悉常见的MV框架，如 AngularJSVueReact； 熟悉响应布局，了解移动端适配原理，要有H5移动端，小程序开发经验；  本科及以上学历，2年以上前端开发工作经验; 有UI设计经验、微信小程序开发经验、Android开发经验、或者IOS开发经验的加分。职能类别：										Web前端开发																			互联网软件开发工程师									",1.0,1.0,1.0,1.0,1.0,0.0
505,vue前端开发,前端开发,14000.0,上海舟恩信息技术有限公司,上海,2.0,大专,"工作职责1. 参与手机Web端和PC Web端的开发，根据产品需求开发高质量WEB产品前端页面； 2. 使用HTML5/CSS3/JS开发网站前端页面； 3. 优化代码实现，提高产品性能； 4. 积极探索互联网前端开发技术的发展， 优化web交互方式，提升用户体验；岗位要求1. 计算机相关专业，大专及以上，拥有2年以上 HTML5、CSS3 开发工作经验； 2. 熟悉Javascript/CSS/XML/HTML 5/PHP等WEB前端技术； 4. 熟悉React/Vue框架者优先； 5. 熟悉JQuery, bootstrap及相关W3C标准； 6. 对不同设备及平台有一定了解，理解不同操作系统及浏览器的兼容性区别",1.0,1.0,1.0,1.0,1.0,1.0
506,前端开发组长,前端开发,18000.0,广州泓展网络科技有限公司,广州,5.0,大专,岗位职责：1、能快速深入理解公司业务，参与项目需求分析，协助PM进行任务规划、任务变更的调控工作；2、负责项目架构设计，包括核心框架设计及核心代码、制定开发计划等；3、提高团队技术技能，配合其他开发组成员完成应用软件开发任务；4、管理前端团队，规划人力安排，评估工作量和反馈开发进度。职位要求：1、计算机相关专业学历，5年以上实际前端开发经历，同时具备 2年以上的开发管理经验；2、精通 H5、CSS3、本地存储、离线应用、 websocket 等技术，轻松把握兼容性问题；3、精通 JavaScript 、 jQuery 、 AngularJS 、Ajax 等 Web 前端编程技术；4、熟悉前后端分离技术，对主流的前端框架熟悉并有深入理解；5、要求会Java或者C#；6、有良好的架构设计理念，对模块化、代码复用有较深的理解，有独立分析问题和解决问题的能力；7、具有较强的逻辑思维能力、组织能力和沟通协调能力；8、有金融相关项目开发经验者优先。,1.0,1.0,0.0,1.0,0.0,1.0
