,职位名称,职位名称关键字,职位薪资,公司名称,地区,工作经验,学历要求,职位描述要求,Excel,Cad,Pmp,Word,Ppt
220,ERP项目管理,项目管理,6000.0,湖北容海信息科技有限公司,武汉,0.0,大专,为了加强公司ERP 系统的管理，要求在ERP 实施过程中，做到岗位责任明确，人员分工明确，系统管理员应由专人担当。2) ERP 系统日常管理是一项综合性很强的工作，要求系统管理员根据分工，在日常工作中必须满足相关职责和技能的要求，从而保证ERP 系统的正常、安全运行。3) 在ERP 系统实施过程中，系统管理员应全程参与，并协助各部门制定信息化实施过程中的相关制度，如：日常操作规范，操作系统安装其他应用软件规范、网络安全规范等。4) 系统管理员在ERP 实施完成后们需要能独立承担软件、硬件、数据库、网络等某几部分的维护工作，并能在以后业务及公司规模拓展时为其他人员提供相关培训。5) 对于信息系统各方面性能的改善，系统管理员有不可推卸的责任，要保证信息系统长期稳定运行，系统管理员必须能够充分发挥自己的作用，规避软硬件等各方面可能存在的风险，并做好相关准备工作，在出现问题时能快速解决。6) 系统管理员有责任对日常工作中遇到的相关问题进行总结，写成文档，进行备份，便于后期维护工作的进行。7) 系统管理员需要根据各部门操作情况及多发性问题，定期或不定期在公司内网发布相关问题处理方法。8) 建立公司“技术支持热线”和“项目管理网络系统”，负责协调各种同信息系统相关的技术服务和相关技术问题的解答。,0.0,0.0,0.0,0.0,0.0
221,科技项目管理经理,项目管理,5500.0,安徽航大智能科技有限公司,合肥,2.0,本科,负责高新企业相关科技攻关项目信息获取；2.负责与相关政府领导和评审专家关系的维护；3.负责科技攻关项目申请的材料准备；4.领导交代的其他事宜。任职资格：1.本科以上学历，有相关工作经验人员优先；2.有一定政府资源；3.性格开朗，响应速度快。,0.0,0.0,0.0,0.0,0.0
222,暖通项目管理员/机电项目专员,项目管理,9500.0,上海富誉制冷设备工程有限公司,上海,1.0,高中,岗位职责：1、建立空调工程作业标准，明确施工工艺，制定出每项工作的作业顺序，使施工有条不紊； 2、按设计要求、操作规程和验评标准向安装队伍、进行技术、安全交底； 3、对图纸及施工中出现的问题及时解决； 4、监督施工过程、质量、原材料检测，基础、中间结构和隐蔽工程验收，对工程资料的收集整理、建筑物定位放线等；5、制定施工安全要求、施工人员安全管理；6、项目甲方、销售人员沟通协调。岗位要求：1、有三年以上工程施工管理经验；具备二级建造师（机电）证书优先；2、对暖通专业知识有所了解，具备较强的学习能力；3、具备管理能力，工作规划性较强，有较强的变通能力及应对突发情况的公关能力。4、能适应工地环境，户外工作；5、沟通能力良好，工作认真负责；,0.0,0.0,0.0,0.0,0.0
223,项目管理人员,项目管理,6500.0,青岛四机设备工程有限公司,青岛,3.0,无,岗位职责：1. 负责公司市场及客户的维护，项目合同的签订和整理，并负责跟踪和监督项目进度，最终成功交付于客户。负责项目执行期间与研发、液压、生产等各部门之间的沟通协调工作； 2. 负责项目的招投标和项目验收工作（主要为验收资料整理和发票管理）；        3. 负责与外部客户沟通项目进展、项目问题，有问题及时反馈，并及时给予合理答复；岗位要求：1、本科及以上学历，机械加工与制造专业优先，三年以上相关工作经验；2、工作态度端正，具有良好的分析和沟通能力及项目阐述能力；3、性格外向，做事认真负责，具有独立的公关能力、谈判能力及一定的策划能力和组织能力；有独立的客户开拓能力者待遇从优。,0.0,0.0,0.0,0.0,0.0
224,项目助理（外贸/客服/项目管理+专英八级）,项目管理,5250.0,广州创品知识产权服务有限公司,广州,2.0,本科,"岗位职责：协助项目经理管理项目（客户为世界500强），为客户（世界知名品牌企业）提供专业的品牌保护解决方案和维权保护服务。1、配合项目经理制定每个项目、案件工作计划和进度；2、按进度完成项目工作目标和要求，配合项目经理对项目小组成员的工作进行监督；3、承担项目日常工作，包括但不限于：对外：a）与客户对接，进行口头或书面翻译，进行有效沟通、交流（书面、电话、会议等）；b）对客户的问题给与咨询和解答，提供解决方案；c）通过分析和沟通发掘客户新的需求；d）及时向客户汇报项目进展；对内：协调公司内部各部门关系，推进项目开展并直至完成，包括但不限于：a）上传下达项目进度，及时准确告知调查部门客户的要求；b）与项目执行部门/人员建立良好的沟通关系，保持信息畅通；c）与相关部门/人员共同解决项目进程中的各种困难和问题；4、根据公司的业务规范，完成项目流程管理和相应的文案（中英文）工作，包括但不限于方案撰写、合同谈判、各类进展报告、各类项目文书等。5、完成上级主管交办的其它工作事项。任职要求：1、 本科或以上学历，专业不限，语言及法律类专业背景优先；2、 英语熟练，英语六级以上，专业英语八级优先；3、 英文笔译和口译能力强，翻译速度快，有法律文书翻译经验优先；4、 具备良好的中文文字功底，口头表达能力好，遇事反应快；5、 1年以上相关工作经验，有项目管理、外贸等行业经验优先；6、 良好的学习能力，上进心强；7、 刻苦耐劳，工作认真细致，有耐心；8、 具有高度的责任心，品行优良，严谨踏实，勤奋敬业，抗压能力强；9、 具备较强逻辑思维及表达能力，善于与客户沟通，快速准确了解客户需求；10、熟练使用office等常用办公软件。11、男女不限。工作时间：周一至周五 09:00-12:00,14:00-18:00，周六日双休；该岗位薪资结构：固定薪资+绩效奖金+年终双薪+通讯费报销该岗位发展方向：项目助理-项目主管-储备项目经理-项目经理-部门经理",0.0,0.0,0.0,0.0,0.0
225,通信项目管理专员,项目管理,5250.0,黑龙江国亚科技发展有限公司,哈尔滨,0.0,大专,岗位职责：1、在工程师指导下进行相关通信网络的测试及优化工作；2、负责相关的责任区的无线通信网络质量；3、负责相应工程现场的协调工作；4、按照公司要求提交相应报告报表等。任职要求：1、通信、计算机、电子、自动化、机械等相关专业，专科及以上学历，18-28周岁，对通信行业有兴趣、有志从事通信行业非相关专业也予考虑。2、不限经验，较强的学习能力，初期有资深工程师带队（接受应届生）3、有较强的沟通协调能力，能与同事、外单位协作人员顺畅沟通4、能够承受一定的工作压力；联系方式：13054297,0.0,0.0,0.0,0.0,0.0
226,项目经理/项目主管/项目管理,项目管理,9000.0,上海首坤智能科技有限公司,上海,3.0,本科,负责项目的售前技术支持，完成售前咨询、方案设计、投标书制作、投标及应答   2.组织和实施面向客户的产品演示会、技术交流会、技术讲座等3.协助销售人员和客户进行各个层面（业务、技术实现）的技术交流和解答   4.配合销售撰写技术方案   5.负责项目策划及组织实施工作 6.协助上级领导完成各类工程的技术方案、项目的技术可行性评估、设计会审、主要设备的技术造型等工作，及时掌握各类标准和政策、业务流程及相关规定，提出落实意见   7.参与本部门各项技术管理流程的制定工作，跟踪和学习最新的技术动态，及时了解新技术、新业务和新设备   8.响应及解决客户的技术要求及终   9.指导、培养中级专业技术人员学习和提高 职位要求：1.本科及以上学历，3年以上相关专业工作经验 2.熟练掌握系统集成和通信技术技能，接收新技术和新业务能力强，技术过硬，能独立处理紧急任务   3.具有丰富的项目管经验，精通相关专业知识，有较强的表达和协调能力，能够有创造性的开展工作   4.善于合作，具有良好的团队精神及较强的组织协调能力，具有良好的人际关系和沟通协作能力   5.工作认真、具备良好的职业道德和敬业精神 6.能够承受较强的工作压力，能适应出差,0.0,0.0,0.0,0.0,0.0
227,项目管理工程师,项目管理,11500.0,深圳市富创橡塑五金制品有限公司,深圳,2.0,大专,工作职责：1、负责公司客户项目需求及客户沟通；2、负责公司内部项目管理，对项目尤其各阶段节点跟进及监控，计划与协调，与客户对接，资源协调，保证达成客户需求；3、统筹项目试产物料跟进，协助品质处理NPI阶段客诉；4、依客户业务项目预估量信息，生命周期等信息提前为项目规划统筹； 5、推动项目NPI阶段过程中异常问题解决直至close； 6、量产前期，推动PMC专案爬坡； 7、定期组织项目例会，检查项目执行状况和成果；8、协调与生产等部门的沟通； 9、加强项目过程风险识别、分析和管控。任职要求：1、大专或以上学历，读市场营销、外贸、商务英语等专业（可接受应届毕业生）；2、英语听、说、写熟练，6级以上，能直接与国外客户进行英语交流；3、有跟进亚马逊，华为，苹果项目优先。,0.0,0.0,0.0,0.0,0.0
228,项目管理（英语、日语、韩语）,项目管理,10000.0,新思考电机有限公司,嘉兴,3.0,本科,岗位职责：协调新案项目的生产、物料、客户等各方面关系。任职要求：1、具有同行业或相关行业3年以上PM工作经验；2、英语/韩语/日语口语流利者优先；3、具有技术背景工作经验，或者相关学历背景。,0.0,0.0,0.0,0.0,0.0
229,研发负责人/项目管理（时钟芯片）,项目管理,15000.0,深圳市创成微电子有限公司,深圳,2.0,本科,岗位职责：1、负责公司时钟芯片团队的管理工作，对各项目实施过程中的问题及风险进行管控；2、负责研发项目进程控制与跟踪，人员及相关资源的协调与组织工作；3、负责工程师的KPI考核，确保项目工程师保质保量的完成任务；4、负责组职协调研发内部资料合理分配。任职要求：1、电子类专业本科以上学历，微电子专业优先；2、熟悉半导体工艺，具备时钟芯片射频/模拟方面实际工作经验；3、具备诚实严谨的科学作风，积极进取、责任心强；4、具有良好的团队协作精神及沟通协调能力。,0.0,0.0,0.0,0.0,0.0
230,项目管理师,项目管理,7000.0,启佳通讯(昆山)有限公司,昆山,2.0,本科,岗位职责1.新机种试产过程中问题点收集及追踪改善进度至结案；2.主导工程变更；3.新材料导入验证可行性；4.协调相关人员及时整合厂内资源沟通反馈给客户。岗位要求 1.本科及以上学历，电子通讯相关专业；2.两年以上PM、MPM工作经验；3.有网通产品项目管理经验者优先；4.英文口语流利。,0.0,0.0,0.0,0.0,0.0
231,通信项目管理,项目管理,5250.0,哈尔滨圣思设计有限公司,哈尔滨,0.0,大专,岗位职责：1、负责施工现场的总体布署；2、协调施工现场的施工进度、质量、安全；3、参加工程竣工交验；岗位要求：1、大专及以上学历，通信、电气、自动化等电力系统相关专业优先；2、经验不限，欢迎16、 17应届毕业生和实习生，年龄28周岁以下；3、吃苦耐劳，具备良好的沟通能力，责任心强，良好的团队合作精神。福利待遇：1、已经公司录用即签正式劳动合同，缴纳五险一金，法定节假日及周六日双休；2、公司提供带薪年假+年终奖+餐补+交通补助+话补；3、完善的培养体系和晋升机制，每3个月一次晋升机会。联系方式：,0.0,0.0,0.0,0.0,0.0
232,施工项目管理系统开发工程师/PMS,项目管理,17500.0,重庆市中科控股有限公司,重庆,2.0,本科,、对建设公司进行项目管理需求分析，编制数字化项目管理任务书，包括：合同管理、成本管理、定额管理、物资管理、进度管理、质量管理、安全管理、文档管理等；                                           2、施工项目管理系统功能排查，明确所需优化和新开发的功能；3、施工项目管理系统的二次开发、测试、优化和维护；4、了解行业***，学习和掌握新技术。任职要求：1、40岁以下，计算机等相关专业，全日制本科及以上学历；2、熟悉1-2款主流的项目管理软件，如广联达、鲁班、YTWO等；3、掌握至少一门面向对象编程语言(C++/C#/Python/Java)，有管理软件开发及维护性工作经验； 4、理解1-2款主流的BIM软件，如Revit、ArchiCAD、Planbar、Navisworks等；5、熟悉装配式建筑行业构件物流运输、现场吊装、连接、验收等施工应用需求，有BIM应用项目经验者优先。,0.0,0.0,0.0,0.0,0.0
233,项目管理,项目管理,9500.0,东莞市慕思寝室用品有限公司,东莞,2.0,大专,本科学历要有两年、大专要有三年以上物流工作经验；2.熟悉SAP系统，有一年以上的操作经验；3.有一年以上的团队管理经验；4.有WMS项目的经验；5.接受一定程度的加班,0.0,0.0,0.0,0.0,0.0
234,项目管理PM,项目管理,12500.0,富士康科技集团iDSBG事业群,深圳,0.0,大专,负责新项目开发工作（从项目定点到项目量产期间的管理）；2. 负责与客户保持良好的沟通：了解客户的要求，并在公司内部展开；3. 负责项目开发中各类会议的召开；（阶段对应会议及PR会议、进度确认会议）4. 负责推进新项目开发中问题的解决；5.精通英语听说读写，有海外背景者优先考虑;6.英语和工科背景为佳。,0.0,0.0,0.0,0.0,0.0
235,科研项目管理员,项目管理,4000.0,佛山市陶瓷研究所集团股份有限公司,佛山,0.0,大专,要求：大专以上学历，财务或统计专业。●具有项目管理或统计等专业知识；●能熟练掌握日常办公软件、网络操作；●具有财务管理等方面的知识。●有数据管理能力；●有良好的人际沟通能力；●责任感强、工作自主，有良好执行能力。●有较强的团队合作精神。岗位职责：●跟踪科研项目资金动向，调整优化各项目资金、科研人员名单，对各项原料、机物料等领用进行合理分配；●跟踪项目进度，督促研发人员进行项目评审及项目佐证资料的编写及整理；●跟踪项目专利的申报；●跟进科技局及其他部门备案的项目进度；●负责完成上级分配的其它工作。,0.0,0.0,0.0,0.0,0.0
236,项目管理员（驻东莞校区+包住宿+带薪寒暑假）,项目管理,7000.0,佛山市南海区翰苑教育培训中心,东莞,0.0,无,一、岗位职责：1、负责自学考试、成人高考、网络教育、职业资格证书的项目推广招生和学生教务管理工作； 2、负责校园团队的组建，学生活动的组织，教学工作的安排。 3、协助完成各类活动策划与宣传，完成部门及团队个人既定业绩目标。4、完成上级交予的其他任务。 二、任职要求：1、大专及以上学历，身心阳光健康、热爱教育行业； 2、具有较强的沟通能力及交际技巧，有责任心，必须能适应经常外出工作，有C1驾驶证优先； 3、本岗位接收优秀应届毕业生、实习生。 三、我们提供的福利：1、薪资待遇：基本工资3500-6000元/月+提成、奖金另计，具体可面议。2、工作时间：8:30-12:00， 14:00-17:30，周末大小周轮休，一周双休，一周单休。3、假期：享受法定假、带（全）薪休寒暑假。4、包住宿（校内教师宿舍） 四、特别说明：工作地址：广东省东莞市厚街文化教育园区学府路1号（广东酒店管理职业技术学院）需常驻东莞校区（包住宿，校内教师宿舍）,0.0,0.0,0.0,0.0,0.0
237,智能项目管理（董事长室）,项目管理,5250.0,可胜科技（泰州）有限公司,泰州,0.0,大专,本科理工科专业，逻辑思维能力强，有一定的分析能力对工厂智能化项目管理感兴趣，应届毕业生亦可善于沟通，熟练使用excel、PPT等办公软件职能需求： 1. 能团队协作、友爱同事2. 勤奋努力抗高压，能配合加班；以上需达到公司试用期考核标准 【薪资福利】技术员：综合薪资4500元/月以上；工程师及以上：综合薪资5500元/月以上；（具体根据个人实际工作经验状况而定）2、加班费：平时工作日加班1.5倍，周末双休日加班2倍，法定节假日加班3倍；3、特殊岗位津贴：夜班津贴260-300元/月，环境津贴50-200元/月，制程津贴100-200元/月；4、年终奖：根据公司盈利状况及员工表现，核发年终奖金；5、医疗：公司医务室免费看诊；6、保险：与公司签订劳动合同，缴纳社保五险；7、活动：公司不定期组织员工聚餐、旅游、节日抽奖活动、体育娱乐比赛等；8、培训：公司依照员工入职时间及岗位开展各类通识及专业培训，以提升员工综合素质；9、晋升：公司提供广阔的晋升空间，每半年进行考评，每年有两次晋升及调薪机会【衣食住行】1、厂服：公司免费提供工作服，每两年更换一次；2、用餐：公司提供免费工作餐及加班餐，员工可自由选择餐点及菜色；3、住宿：公司提供住宿，房间配有空调、卫生间、淋浴等设施、投币洗衣机等；4、其它设施：生活区及厂区设有超市、咖啡厅、自动购物机、银行自助取款机、医务室、心理访谈室、员工意见箱等。,1.0,0.0,0.0,0.0,1.0
238,通信工程项目管理员,项目管理,3750.0,哈尔滨谦发科技有限公司,哈尔滨,0.0,大专,任职要求：          1、大专学历，18-27周岁          2、因行业特殊性，有性别要求          3、不限经验，初期有工程师指导                      4、能在行业长期稳定发展工作内容：         1、移动网络运营维护、技术支持等工作         2、通信设备软件测试、调试、交付使用         3、联通、移动运营商直放站网络协调工作         4、跟随督导、监理等公司老员工学习并了解移动4G项目内容及步骤         5、跟随督导、监理等公司老员工了解公司项目规程，学习工作中所需技术联系方式：13054297,0.0,0.0,0.0,0.0,0.0
239,项目管理专员,项目管理,7500.0,深圳市盈创家具有限公司,深圳,2.0,大专, 1、熟悉装饰工程现场施工工艺流程、展示道具制作工艺，具有建筑装饰、家具行业工作3年以上经验；2、全日制大专以上，设计、装饰工程类专业毕业；3、能完成每单项工程完工后的总结与分析报告；4、能熟练操作CAD等设计软件。,0.0,1.0,0.0,0.0,0.0
240,项目管理工程师,项目管理,10000.0,深圳市方向电子有限公司,深圳,3.0,大专,"大专以上学历，机电一体化相关专业；2. 有汽车连接器行业项目管理经验,能看懂连接器图纸。3. 沟通能力强，抗压力强；4.主要负责新项目管理工作。",0.0,0.0,0.0,0.0,0.0
241,管理培训生/储备干部-项目管理(建筑项目助理）,项目管理,5000.0,富顿技术（广州）有限公司,广州,0.0,本科,、项目管理方向：项目运营过程中，配合主管及上级领导的要求完成分派的任务，包括协调跟进各部门工作进展、会议安排、厂家出差跟踪工程材料进度、材料发货安排、各类计划文件的定期更新等；2、工程造价方向：承担公司项目的造价咨询、投标报价、商务预审文件的准备，成本控制、审核及工程结算工作。3、投标方向：承担幕墙工程项目市场信息的收集、项目投标跟踪、谈判、合同签订等工作。4、质量监控方向：监控和把握幕墙工程中所有材料及设备的安全、进度、材料质量等方面的管理工作。任职要求：1、本科学历及以上工程管理、土木工程、建筑幕墙、工业与民用建筑、工程造价、工程管理、房屋建筑、安全工程等专业；2、经验不限，应届毕业生均可；3、逻辑思维清晰，工作认真仔细，能吃苦耐劳，沟通能力强；4、熟练办公软件Word、EXCEL操作，会使用CAD软件优先考虑；5、优先考虑有较好的英语基础（或英语四级及以上）。,1.0,1.0,0.0,1.0,0.0
242,项目管理工程师,项目管理,5250.0,江西联创宏声电子股份有限公司,南昌,2.0,本科,、进行项目进度、成本、和质量方面的管理；2、跨部门协调项目成员工作，协调各方面资源以推进项目进度；3、组织召开项目会议、参与项目各级评审等。任职要求：1、大专及以上学历；2、具有技术管理经验优先，了解机械结构原理；3、了解技术文件的编制、会pro/e、cad、caxa等相关作图软件；4、具有良好的沟通能力，有从事标准化工作者优先。注意：地点：瑶湖西六路~,0.0,1.0,0.0,0.0,0.0
243,项目管理员,项目管理,9500.0,深圳市利和兴股份有限公司,深圳,3.0,大专,、项目立项，推进项目整体进度；2、协调安排项目所需资源；3、协调人员及客户问题跟进处理；4、项目各节点的进度把控，处理异常情况，准时达到项目交期完成；5、具备较强的沟通协调能力，有自动化项目管理经验者优先。,0.0,0.0,0.0,0.0,0.0
244,项目管理专员,项目管理,5250.0,浙江伟星实业发展股份有限公司,台州,0.0,大专,、负责项目管理流程的搭建与优化、公司重点项目立项审批及进度检查2、负责项目计划进度的跟踪，项目中涉及的跨部门沟通与协调3、负责技术人员的绩效考评结果的审批4、负责技术线人员相关的激励、评价、考核制度，开展提升技术线人员能力的各项培训工作5、负责质量奖的测评与整理工作任职要求：1、大专及以上学历2、具有较强的责任心3、能熟练操作OFFICE办公软件，如：PPT、EXCEL等4、具有一定的文字功底，有较强的沟通协调表达能力、熟悉拉链生产流程的优先,1.0,0.0,0.0,0.0,1.0
245,项目管理工程师.,项目管理,10500.0,昆山联滔电子有限公司,昆山,3.0,本科,"						岗位职责:带领团队以完成客户及组织所要求的milestone & budget1.负责项目开发计划书之拟定与项目管控2.新产品设计规格确认与审查3.项目开发日程进度管控与追踪4.产品、零件、项目开发总成本之分析及管控5.设计开发与新产品导入对应客户窗口6.产品开发过程中R&D各部门的问题解决与沟通协调7.成本控制 任职资格:1.本科及以上学历,具有5年以上项目管理经验。2.英语四级以上，工商管理/电子/工业工程相关专业3.精通office办公软件，尤其是函数公式运用4.具备产品、零件、项目开发总成本之分析及管控能力，有较强的跨部门推动协调能力者优先。",0.0,0.0,0.0,0.0,0.0
246,项目管理工程师,项目管理,7000.0,广东优赛科技有限公司,东莞,1.0,大专,【你的工作】1.根据项目实际情况制定项目进度计划，协助项目经理编写项目可行性研究报告，控制项目进度；2.负责各类政府资质项目申报、鉴定、验收；3.与客户方项目负责人进行不定期沟通，定期汇报项目进度；4.组织项目管理培训，规范项目管理；5.给予企业知识产权的保护建议与战略规划；6.完成上级交办的其他工作。【任职要求】1.大专及以上学历理工科专业优先；2.具有较强专业理论基础及写作能力，对项目材料有较好的逻辑分析及组织能力；3.熟悉科技项目申报流程者优先；4.制造业工作经验优先；5.踏实严谨，诚实敬业，积极主动，灵活应变；【薪资待遇】1.薪资待遇: 固定工资+绩效工资+奖金+带薪年假+节日福利+生日福利+社会保险+股权分红；2.培训机会：入职一个月之内，专业部门组织开展完整的新人培训；3.聚餐福利：重大节日外加不定期团队聚餐，发放节日礼品；4.生日福利：员工生日礼品发放；5.晋升通道：凭借个人的实力，入职按能力享受职级，每月都有机会晋升。所有管理岗位均从内部员工提拔产生：项目工程师-高级项目工程师-副经理-经理-助理总监,0.0,0.0,0.0,0.0,0.0
