,职位名称,职位名称关键字,职位薪资,公司名称,地区,工作经验,学历要求,职位描述要求,Excel,Cad,Pmp,Word,Ppt
453,项目管理岗位,项目管理,6500.0,河北人和环境科技有限公司,石家庄,0.0,无,"、负责所在环卫项目的城乡垃环卫一体化运营和管理工作，确保环卫服务的品质；2、负责贯彻公司的管理方针，落实各项规章制度及工作流程，保证政府环卫部门及社区居民满意率，从而完成项目的经营目标；3、及时完成项目各项日常工作，并及时汇报工作完成情况，做好跟政府领导的沟通工作；4、做好员工安全生产培训，避免各种安全隐患的发生； 5、负责协调项目所在地政府职能部门的关系； 6、负责下属的培训、考核、晋升等管理工作；做好团队建设及人才培养工作。任职要求：1、大专以上学历,有两年以上项目运营管理经验，具备城乡环卫一体化项目、物业管理工作经验优先考虑；2、热爱城乡建设环卫服务行业，具有良好的沟通协调能力；3、工作严谨细致，善于分析，且具团队合作精神；4、有良好的抗压能力，能够接受驻外。工作地点：河北省内，需要驻外工作。",0.0,0.0,0.0,0.0,0.0
454,项目管理工程师（武汉）,项目管理,7000.0,苏州华工自动化技术有限公司,武汉,3.0,无,岗位职责：1、协助项目经理进行项目进度跟踪管理，全程参与项目开发、跟踪、管理、运作；包括项目进度管控、价格核算、发货管理、售后服务管理等。2、协助项目经理制定项目计划表，包括资源、预算、时间等；追踪落实相关责任部门责任人的工作进度。3、协助项目经理跟踪管理所负责的自动化项目，输出项目进度表。4、汇总自动化项目实施中的问题点，协调公司内部部门解决项目中的问题点，跟进项目进度。5、协助项目经理进行价格核算、成本管控、交付管理、发货管理、售后服务协调等事项。6、协助解决项目中的文件资料处理任职要求：1、英语口语熟练，可以独立进行外文资料翻译、能够与客户进行口语交流者优先，有一定基础的机械专业英语优先。2、2年以上项目管理工作经验；有非标设备类项目管理经验者优先；3、具有较强的沟通能力和良好的团队合作精神；4、性格外向、乐观、积极主动、富于挑战力，有较强的抗压能力及专案管理能力，在紧张状态下能够控制自已的情感和行为。5、身体健康，品行良好，能配合项目需求出差及加班。工作地点：武汉,0.0,0.0,0.0,0.0,0.0
455,项目管理及报价专员,项目管理,7000.0,常州协丰医药研发有限公司,常州,3.0,硕士,						岗位职责：1、负责项目询价、报价、立项、订单的跟踪与确认；2、负责询价项目的路线设计和成本核算；3、负责与客户及合成部门保持良好的沟通，及时跟进发送的报价，促成更多的成单；4、负责对对应项目的成本同其他相关小组做好整体的分析，为后续的项目报价做好决策支持；5、负责确定意向项目的合同编写，讨论和生效；6、负责报价及项目管理过程中其他问题的协调和推进；7、负责项目总结、数据统计，做到及时、有效、无误。任职要求：1、相关专业背景(化学、药学等相关专业），硕士及以上学历;2、具备3-5年以上的有机合成经验，有报价经验优先;3、英语读写能力优，听说能力较好;4、工作态度积极严谨，细心，责任心强;5、较强的沟通交流能力，良好的团队合作精神。																		,0.0,0.0,0.0,0.0,0.0
456,项目管理员,项目管理,4500.0,成都合技通科技有限公司,成都,0.0,无,"、全面负责通信工程建设的项目相关施工管理工作。2、对所承担的工程项目的质量、进度、成本控制负责。3、负责与甲方、监理、施工单位的工作接洽、协调、组织，协同施工单位设计会审,现场交底,协调各方面的关系。4、组织编制竣工资料、工程结算、参加工程验收和工程交接工作，顺利完成工程项目验收工作，组织工程保修和工程服务工作。5、协助完成招投标（技术）工作。任职资格：1、相关专业大专及以上文凭；2、有1-3年工作经验，熟悉通信弱电工程施工与管理，会CAD，会驾驶。3、有建造师证书者优先。",0.0,1.0,0.0,0.0,0.0
457,商学院EMBA Class Coordinator课程主管项目管理-00228,项目管理,,中欧国际工商学院,上海,5.0,本科,"						Major Responsibilities:？	Class Management and coordination;？	Teaching management and coordination to courses when needed;？	Events and projects planning and organizing;？	Program administration system support;？	EMBA admission support when needed;？	Other functions and Dept. support within CEIBS when needed.Basic Requirements:？	5+ years working experience in administration function;？	Outstanding interpersonal and communication skills;？	Strong coordination skills;？	Customer service oriented;？	High ethical standard;？	Mature, team-player, energetic;？	Detail-orientated, high sense of responsibility;？	English proficiency and good commend of computer, power point and access are particular.																		",0.0,0.0,0.0,0.0,0.0
458,项目管理PM,项目管理,9500.0,捷普集团-绿点科技（苏州）有限公司,苏州,5.0,本科,一、任职要求：1、本科及以上学历，机械、电子、英语相关专业；2、五年以上3C行业项目管理、EPM相关工作经验；3、英语口语流利，能直接对接客户；4、相关消费性电子行业优先，熟悉结构件，塑胶件，塑胶模具工艺优先；5、熟悉商务谈判，有apple产品对接经验者优先;6、熟悉NPI阶段项目管理。二、岗位职责：1、负责新项目报价，技术研讨；2、编制项目开发节点计划；3、根据项目计划跟踪项目开发进度；4、组织小组成员进行试模后问题点评估，并将原因分析和改善对策提交给客户；5、跟踪试模产品出现的NG尺寸复测；6、确保开发及交付的产品满足客户要求（质量、时间节点）；,0.0,0.0,0.0,0.0,0.0
459,项目管理工程师,项目管理,5250.0,无锡华润华晶微电子有限公司,无锡,3.0,本科,组织项目可行性分析、提交立项评审文件。2.根据项目需求、组建项目团队。3.设置项目目标及计划、分解工作任务、规划工作计划任务网络图并实时更新。4.根据项目需要，及时提出相应的资源需求，并落实到位。5.组织协调研发、工厂、销售、应用等落实项目节点工作任务。6.负责向项目组成员、项目发起人及领导汇报项目进展。7.对接项目上量前业务风险订单需求的技术协调工作。8.做好风险防范与应对，致力达成项目目标；9.积极调动项目组各项工作，过程中有能力进行协调与判断，并将项目进展及时向上级汇报。职位要求：1.本科以上学历，微电子相关专业优先；2.2年以上前道晶圆工作经验，熟悉MOS、IGBT、二极管等功率器件机理或工艺者优先；3.大学CET-4 能够阅读与专业相关的资料；4.熟练使用办公软件。,0.0,0.0,0.0,0.0,0.0
460,软件开发、项目管理工程师,项目管理,6500.0,南京中铁信息工程有限公司,南京,3.0,本科,工作职责：1、负责客户的信息化维护服务和指导；2、根据客户需求，负责制定相应的变更实施方案；3、出差及项目驻场技术服务；例如：江苏和安徽两省；4、产品的功能、安全、质量、性能需求在产品设计工作中的技术实现；5、软件架构设计，包括需求定义，接口和协议设计，数据库设计等；6、软件详细设计，如功能类定义，接口类定义，交互界面的设计等；7、根据详细设计文件进行代码实现和调试，并进行模块级测试；8、编写软件测试计划和测试案例，测试环境设计与搭建，实施具体的测试验证。岗位要求：1、计算机及相关专业毕业，本科以上学历，具备良好的英语阅读能力；2、三年以上企业级应用开发经验，可独立开发程序前后端，具有项目组管理经验，能高效带领开发团队完成项目实施；3、对客户需求对接、项目进度安排、人员调整、制定开发规范； 4、良好文档撰写能力，思维敏捷流畅，文档结构简洁清晰；5、具备强烈的进取心、求知欲及团队合作精神，有较强的沟通及协调能力；6、具备项目管理相关经验；一经录用，驻场南京用户现场负责软件运维管理工作；7、简历提供照片。,0.0,0.0,0.0,0.0,0.0
461,工程项目管理专员,项目管理,6000.0,浙江永太科技股份有限公司,台州,0.0,大专,、GMP生产装置的设计、安装、调试、验证、档案管理；2、设备设施系统的运行体系管理：预防性维修计划及计划实施、设备完好标准巡视检查评比、设备日常维护保养、设备设施的完好状态保持；3、负责车间一级设备日常管理工作；4、计量、仪表的管理；5、其他相关事宜。岗位要求：1、化学工程与工艺、化学工程、制药工程相关专业大专以上学历，有相关经验者优先考虑；2、熟练使用电脑办公软件，特别是CAD制图。,0.0,1.0,0.0,0.0,0.0
462,项目管理工程师,项目管理,7500.0,新辉开科技（深圳）有限公司,深圳,3.0,大专,任职资格：大专以上学历；机械设计等理工科专业；两年以上LCD/LCM/TP行业工作经验；有液晶显示、触摸屏行业电子、结构等方面技术背景；熟悉工厂生产项目的管理流程；具备良好的项目风险、进度、交期管控能力；具备良好的沟通表达能力和织协调能力；工作认真严谨，责任心强；,0.0,0.0,0.0,0.0,0.0
463,项目管理,项目管理,9000.0,上海菲格瑞特汽车科技股份有限公司,上海,1.0,本科,任职要求：1、本科及以上学历；2、汽车类专业或者机械类专业毕业；3、具有较强的执行力，良好的沟通和组织能力、统筹能力；4、能单独有效的完成整个项目流程并对整个项目部工作的开展有效管理和监督；5、具备较强方案策划能力，熟悉整车生产工艺流程；岗位职责：1、负责制定项目计划，分配任务；2、控制和协调项目过程中涉及到问题；3、负责与客户进行沟通，并将客户要求转化成公司项目标准；4、负责项目的资源整合，制定各项目预算，审核报价控制项目质量与成本；5、在项目实施过程中的现场管控；6、完成项目工作总结，项目归档，项目工程质量改进方案。,0.0,0.0,0.0,0.0,0.0
464,心理学项目管理经理助理(EAP),项目管理,3750.0,苏州天力咨询有限公司,苏州,1.0,本科,						岗位职责：1、协助项目经理和咨询管理专员完成交代的任务；2、协助项目经理和咨询管理专员及时完成工作量统计和费用核算、发票开具、寄送等方面的工作；3、协助进行部门业务拓展和宣传推广方案制定方面所需的材料和信息收集，并参与方案制定的讨论。在主管的指导下做好宣传推广的落实；4、协助项目经理以及咨询管理专员做好项目落实过程的协调沟通、数据分析、师资管理等所需要的事务性支持，并完成项目经理所交代的项目有关事务；5、协助完成公司产品开发过程中所需要的资料和信息方面的支持，做好事务性工作安排；6、协助项目经理和咨询管理专员做好师资招募、沟通维护，师资费用核算等管理方面工作落实过程中的事务性支持；7、协助项目经理和咨询管理专员做好客户信息收集、客户档案管理、客户沟通维护、客户答谢等方面工作的落实；8、协助部门做好项目成本核算、经营分析等事务性工作；9、协助咨询管理专员做好咨询安排、咨询师督导学习、咨询工作量统计等咨询管理过程中的事务性工作；10、协助部门相关人员做好公司网站建设、宣传产品制作、社会公益活动等有关工作落实，负责公司微博、QQ、月刊等宣传推广方面工作的管理；11、协助咨询管理专员做好公司测试服务系统的管理和优化等工作过程中的事务性工作；12、协助做好部门团队建设活动的落实，不断学习，提高自身的业务水平；13、其他部门工作以及部门主管安排的工作。任职要求：1、心理学、教育学、管理学、人力资源管理相关专业，本科及以上学历；2、掌握心理学相关专业知识，文案撰写能力强，有国家心理咨询师证书者优先；3、熟练使用OFFICE、SPSS等软件；4、有良好的团队精神，人际沟通能力强、工作细心，上进好学、自信自律、责任意识及原则性强；																		,0.0,0.0,0.0,0.0,0.0
465,项目管理,项目管理,12500.0,飞旭电子（苏州）有限公司,苏州,5.0,本科,"负责执行项目管理，规划及收尾2.保证工厂及客户按合约条款执行3.配合工厂顺利导入新产品生产与客户确定产品出货形式等相关工作4.主导产品BOM的建立和维护，项目产品，生产物料的准备/管控及产品设计变更和控制5.负责订单接收/客户资料审核/客户交期确认及订单展开/订单报价/异常处理/客户关系维护/客户接待等事项6.良好沟通厂内、客户和CFT7.定期主导CFT会议并带领CFT按照客户需求日期达成出货目标,保证品质，减低库存8.达成利润及P&L目标，保证报价利润达成9.达到客户满意、配合客户研讨季度业务考核QBR10.协助项目部经理对项目进行分析，解决问题11.完成上级安排的其他工作任职要求：1.大专及以上学历，英语良好，计算机操作熟练。2.逻辑思维条理清晰。3.强烈的责任心，良好的沟通技巧和抗压能力，良好的项目执行力及服务精神。4.要求熟悉TS16949,至少5年以上的工作经验，有相关汽车电子行业经验;厂车：免费提供到苏州园区、市区、新区路线的厂车",0.0,0.0,0.0,0.0,0.0
466,资料员（项目管理中心）,项目管理,6250.0,深圳市艺涛装饰设计工程有限公司,深圳,2.0,本科,、收集整理齐全工程项目前期的各种资料；2、指导各工程项目部收集、整理资料；3、检查各部门整理的工程项目相关资料的合规性、完整性并督促其及时完成；4、收集、编制有关施工文函件资料；5、汇总统计、装订竣工资料成册；6、执行有关文件、图纸等收集、发放工作；7、登记保管好各工程项目部的资料。任职要求：1、大学本科以上学历，工程建筑类专业优先；2、1-2年建筑装饰行业资料管理工作或相关工作经验；3、了解建筑装饰工程资料的构成和标准、规范，能识别不符合的情形4、良好的沟通能力、办同能力5、熟练应用OFFICE等办公软件；CAD略会，精通更好备注：服从公司安排、可外驻，责任心强、肯吃苦职能类别：										资料员									关键字：需要外驻工地,0.0,1.0,0.0,0.0,0.0
467,项目管理,项目管理,12500.0,上海银澜智能化工程有限公司,上海,3.0,大专,"任职资格1、 熟悉弱电工程项目实施、管理，中等要求：有独立负责200万以上项目的经验，低等要求：2年以上项目管理经验。2、 监督并确认项目规划及运作管理等，包括项目评估、成本控制、进度控制、质量、风险及采购管理等；3、 协调能力强，负责对内与对外的所有沟通和协调工作；4、 人际沟通能力强：能处理好甲方或业主、物业、兄弟施工单位、下包以及公司其他部门的关系；5、 技术能力：可以简单修改处理技术图纸，深入理解技术方案，可以将技术方案的具体要求向施工队伍贯彻实施；组织制定项目年度预算及利润目标等；6、 定期制定施工进度计划表交给公司；7、 吃苦耐劳，责任心强：及时发现工地现场的不足并处理，无法处理的及时反馈信息；8、 良好的计划和执行能力：具备在项目实施前，能做好项目预算，估算项目难度，提出解决方案；9、 积极主动，具备团队意识，具有高度的责任心，能够承受较强的工作压力。熟悉: 智能建筑弱电系统 比如视频监控、门禁、停车场 综合布线 ,会议系统等.欢迎访问公司网站，对公司有所了解后再投递简历，以免浪费您宝贵的时间！公司网址：http://www.yinlansh.com 如果无法打开请访问：http://203.156.204.37/   谢谢！",0.0,0.0,0.0,0.0,0.0
468,NPI新产品项目管理,项目管理,7500.0,广州番禺旭东阪田电子有限公司,广州,3.0,大专,岗位职责：1、跟进营业和客户发布新产品信息。2、把握新产品信息，组织技术+制造+品証+生管对新产品做可行性评审，对工场制造产能现状把握，核算产品报价并提交营业。3、把握新产品导入过程管控，根据产品要求制定合理的导入计划，提前做好相关的准备（产品BOM，工艺基准表、工装夹具及资料准备等）确保新产品导入过程中有序和稳定。4、熟练操作ERP系统，负责新产品材料+货物调拨过程跟进。5、熟悉车载体系要求，熟悉相关文件做成和评审。6、召集和组织新产品可量产前期评审，并跟进量产前问题关闭。7、新产品量产前后客户变更的发布、追踪、管理。任职资格：1、从事注塑成形新产品项目管理3年以上，能够综合处理新产品导入过程问题，具有成形模具、材料、工艺基础知识，日语or英语沟通能力具备。2、了解TS16949的要求，成形新产品报价核算和评估。3、具备和客户营业资材沟通经验。,0.0,0.0,0.0,0.0,0.0
469,项目管理工程师（自动化方向）,项目管理,7500.0,江苏迪盛智能科技有限公司,苏州,2.0,大专,岗位职责：1、负责成立项目组，制定项目实施的总体计划、需求，确定项目组人员、分各模块时间节点；2、负责各模块项目组成员工作的衔接和协调工作，负责项目实施前期和后期客户方的充分沟通；3、负责项目实施过程中各种项目成本的管控工作、项目组成员激励工作；4、负责推动项目按照时间节点完成验收；5、负责在保质期内，与客户提出的整改要求及时响应，并督促整改；7、完成领导交办的其他工作。岗位要求：1、大专及以上学历，工科背景，熟悉自动化行业；2、2年以上自动化整线方案制定及项目主导实施经验；3、具备较强的沟通及协调能力，有一定的文字功底，对数据统计分析，时间的把控强；4、能适应出差；5、抗压能力强，责任意识强，有英语语言基础。,0.0,0.0,0.0,0.0,0.0
470,软件项目管理工程师,项目管理,17500.0,成都九玄数码信息有限责任公司,成都,0.0,本科,。了解或熟悉通讯协议（在通信行业有软件开发经验优先）2。有软件项目管理经验3。有扎实的软件技术基础4。良好的学习能力5。良好的沟通能力6。良好的协调能力,0.0,0.0,0.0,0.0,0.0
471,学习项目管理,项目管理,10416.67,深圳市启承管理咨询有限公司,深圳,0.0,本科,岗位职责：1. 方案及产品策划在已有的知识库基础上，根据客户需求制定及设计客户化课程培训方案；根据客户招标要求，撰写标书；公司现有产品的修订完善及更新维护；知识库的补充与整理，知识技能整合。2. 销售支持：协助客户经理跟进客户需求，清晰理解客户需求；标书制作，参与投标。3. 咨询项目执行独立实施咨询式培训课程（课前需求调研、课中培训组织、课后培训效果评估等）；协助完成咨询式培训项目方案设计及项目调研、访谈、分析、整合、产出4. 与咨询顾问、讲师的配合性工作岗位要求：本科及以上学历，3年以上工作经验，优秀的应届毕业生亦可，优秀一等高校毕业优先，有培训课程方案设计经验优先；精专word、Excel、PPT，善于运用各种表格、数据和图形，以达图文并茂；擅长视频剪辑，以视频作为课程宣传材料或课程总结材料，以达到直观影响力的效果；具有较强的文字撰写和快速的编辑能力；具备优秀的语言表达能力以及简报技巧；具有较强的成就欲望、团队意识、创新能力、逻辑思维能力强；喜欢分享，有志在培训和咨询行业发展，能适应出差，抗压能力强；,1.0,0.0,0.0,1.0,1.0
472,项目管理专员,项目管理,7000.0,时趣互动（北京）科技有限公司,广州,2.0,大专,工作内容：1. 负责项目执行过程中付款单据信息的收集、录入、统计、分析工作。2. 负责供应商的合同签署流程。 3. 负责项目执行过程中统计及分析工作，按进做好周报、月报，报业务负责人。4. 负责项目付款流程过程中的沟通和联络工作，保证项目推进。5. 领导安排的其它工作；任职资格：1. 大学专科以上学历，2-4年工作经验；2. 工作热情积极、细致耐心，具有良好沟通协调能力;3. 具有服务意识，能适应较大的工作压力；；4. 熟练使用EXCEL，WORD，PPT等办公软件；5. 较强的沟通表达能力和团队合作能力；6. 能够跨职能、跨部门沟通推进项目，善于创新思考；,1.0,0.0,0.0,1.0,1.0
473,项目管理岗-副总-工程咨询公司,项目管理,16666.67,昆明培铭科技有限公司,昆明,5.0,本科,、应用现代信息技术管理工程建设项目的全过程咨询。2、与工程建设各方（含发包方、承包方、设计、监理、造价）进行无障碍沟通；全面负责项目过程中的所有问题；3、根据公司项目组织机构编制要求，确定项目组织机构和人员安排，落实各管理人员职责，组织项目开展工作；4、负责公司技术标准在项目的推行、技术管理措施的落实；5、主导专业重大技术方案评审，日常现场技术问题、疑难技术问题的研讨解决，促进公司技术平台的搭建完善；及时学习新材料、新工艺、新规范、新政策并在项目团队内部培训分享宣贯； 6、负责建立项目的合同管理体系，严格履行合同管理任务，组织协调施工过程中各方面、各部门之间的关系，解决矛盾冲突，保证项目如期完成，组织实施对项目工程进行全面验收；7、负责组织工程实施中政府有关部门、市政部门、公用事业部门、设计单位、施工单位和监理单位等各方面的综合协调工作；8、监督、管理工程的实施，检查并记录工程的实施计划和进度、设计图及相关标准、工艺过程和施工工序；9、负责部门管理工作。10、完成领导临时交待的其他工作任务。,0.0,0.0,0.0,0.0,0.0
474,销售（项目管理）,项目管理,9000.0,哈工大大数据集团四川公司,成都,0.0,无,岗位职责：1、有效的完成人工智能教育项目销售；；2、客户的开发和跟踪，客户的拜访与维护，熟悉掌握人工智能教育项目相关产品的具体情况；3、能够独立处理销售过程中遇到的各种产品问题；4、为潜在客户进行行业前景分析、市场发展趋势分析及相关产品知识讲解；5、定期进行工作汇总，并将完成进度、工作总结和相应的数据表格上报领导；6、领导交办的其他事项。任职资格：1、大专以上学历，具备计算机软硬件基础知识；2、具有良好的表达能力和沟通、应变能力；3、有强烈的学习欲望和良好的学习习惯；4、喜欢销售、喜欢挑战、具备主动性；5、有教育产品销售、机器人销售经验可以优先考虑；6、具备出色的语言表达能力、沟通能力和客户服务意识；；7、良好的团队协作精神和客户服务意识。我们能给你的：我们能给你的：1、朝九晚六，入职购买六险一金，半小时弹性工作制，周末双休。2、集团强大的人工智能技术团队，提供专业人工智能机器人培训，3、咖啡√，下午茶√，水果√，零食√，贴心圈养每一头员工。4、不定期团建旅游，蓝天白云，牛羊作伴。工大云关安全科技（成都）有限公司为哈工大大数据集团四川公司平台下子公司，主营业务为人工智能教育及教育型机器人、商用服务型机器人，面向广大高、中、小学生，致力于将人工智能带给每个学生。公司依托科学的教育理论，在国家政策大力支持下，创建全新的课程内容、教学模式、评价体系，为青少年提供全面人工智能教育平台。企业使命 :帮助他们理解与探索AI智能领域，进而提高本省，全国乃至世界的AI教育水平！ “少年强 则中国强”，让中国的AI技术达到世界一流！实现教育产业化，让各个地方的小孩子享受到与大城市小孩同等的教育水平。带来更多活力，与工大云关携手共发展，同成长！,0.0,0.0,0.0,0.0,0.0
