,职位名称,职位名称关键字,职位薪资,公司名称,地区,工作经验,学历要求,职位描述要求,Excel,Cad,Pmp,Word,Ppt
0,项目管理工程师/项目主管,项目管理,7500.0,上海智科仪器设备有限公司,上海,3.0,大专,岗位职责：1、负责公司产品及服务的售前及售后服务支持工作；2、按照公司要求和项目情况有效地完成售后任务，并能独立处理和解决所负责的任务；3、跟踪实验室集成项目执行过程状况，并根据遇到问题作出解决对策；4、对项目实施过程进行监督和反馈；5、配合项目交货交接和验收工作。任职要求：1、工作踏实认真，具有强的责任心和积极的工作态度；2、具有快速的学习能力和适应能力；3、有较强的沟通能力能够随机应变，能够适应团队协作并能独立完成项目；4、具有一定的抗压能力并能熟悉实验室设备和项目集成或有一定的售后经验者优先考虑。,0.0,0.0,0.0,0.0,0.0
1,项目管理经理,项目管理,22500.0,融创（深圳）房地产有限公司,深圳,5.0,本科,岗位职责:1、负责控制工程项目的现场施工进度，确保工程项目进度计划的完成；2、严格监督工程项目施工质量，参加工程检查验收，隐蔽验收及工程材料检查验收；3、参加工程现场经济签证的审查确认，确保工程项目成本控制目标的实现；4、负责协调总、分包配合工作及现场工程的日常管理工作。任职要求:1、统招本科及以上，土木工程、工程管理等专业；2、7年以上工作经验，5年以上房地产公司工程工作经历，至少有2年地块负责人管理经验；3、优先考虑有山地项目经验的人员；4、较强的现场施工组织能力及沟通、协调和管理能力，责任心强，有较强的团队合作意识。,0.0,0.0,0.0,0.0,0.0
2,电子电器多国认证项目管理专员,项目管理,6500.0,SGS通标标准技术服务有限公司上海分公司,上海,0.0,本科,"负责电子电器产品的国际认证专项事务，包括认证咨询，报价，国际认证项目申请等；-负责国际认证项目管理、定期更新项目进度给内外部客户，保证项目按计划完成；-负责了解最新的法规标准及技术要求，定期维护和更新国际认证的SOP和数据库；-负责与海内外合作机构的关系建立与维护，策划邀请合作机构来访及招待，商谈合作事宜。-配合市场部的认证推广活动，参与研讨会或者客户拜访，内外部客户培训；-负责认证相关的记录及其他日常事务。职位要求: -本科学历，电子电气相关专业、或西班牙语、日语、阿拉伯语相关专业者优先；-工作经验不限，有无线背景或外贸背景优先；-良好的组织协调与沟通能力,有团队合作精神;-做事细致有耐性、逻辑思维及自学能力强;-能够独立完成工作，自我激励及抗压能力强;-熟练操作各类办公室软件;-英语四级或以上，良好的英语听读说写能力，有第二外语优先考虑。福利 五险一金;补充公积金;员工旅游;餐饮补贴;免费班车;专业培训;年终奖金;定期体检;带薪年假;高温补贴;节日福利",0.0,0.0,0.0,0.0,0.0
3,采购项目管理-南京,项目管理,12500.0,霍尼韦尔（中国）有限公司,南京,0.0,本科,"要求：做过电子元器件的采购，有新项目采购经验，沟通协调能力强，英文流利！At Honeywell, we look for people driven by a desire to  contribute, be challenged and grow. Our people make Honeywell a special company  and are a key competitive advantage. Be part of NPI team assessing and driving achievement of  program specific performance within Honeywell Safety Productivity Solutions.  The role will work closely with the NPI Program Manager and Design Engineering  Team, within HIS sourcing organization, and Business Unit leadership in the  areas of NPI launches and Productivity acceleration.在霍尼韦尔，我们寻找的是那些渴望贡献、挑战和成长的人。我们的员工使霍尼韦尔成为一个特殊的公司，是一个关键的竞争优势。作为新产品导入团队的一员，评估和推动霍尼韦尔安全生产力解决方案的具体项目绩效。该职位将与新产品导入项目经理和设计工程团队紧密合作，在他的采购组织内，以及新产品导入启动和生产力加速领域的业务部门领导。Principal  Accountabilities:? Represent sourcing team as key drivers in NPI project for  most suitable supplier base selection. ? Drive NPI projects for respective LOB’s to successful  completion on time and meeting project needs for cost and cycle time? Pull through PSL supplier savings on current business when  awarding NPI? Partner with sourcing stakeholders, including Product  Management to ensure appropriate sourcing measures and metrics are in place and  deployed that measure progress against initiatives ? Deliver KPI’s and develop necessary corrective action  plans if need? Communicate with engineering teams to align project  expectations from sourcing? Support Technology symposiums for Design Engineers? Maintain continuous in-depth knowledge of market  conditions, industry trends, and developing technologies ? Deploy processes that are consistent with the sourcing  strategies.? Maximum Improve 2nd source and incumbent PSL  implementation during NPI stage? Support the selection and management of suppliers who have  the capacity and capability to meet the material and subcontract needs of the  project. ? Manage all Sourcing escalations related to related NPI  projects.代表采购团队作为新产品导入项目中最合适的供应商基础选择的关键驱动力。推动各LOB的新产品导入项目按时完成，满足项目的成本和周期需求?在授予新产品导入时，通过PSL供应商在当前业务上的节省?与采购干系人(包括产品管理人员)合作，确保适当的采购措施和指标到位并部署到位，以衡量针对项目的进展交付KPI并根据需要制定必要的纠正措施计划与工程团队沟通，协调从采购到的项目期望?为设计工程师提供技术研讨会支持?持续深入了解市场状况、行业趋势和开发技术?部署与采购策略一致的流程。?在新产品导入阶段***限度地改进第二大来源和现有PSL实施?支持有能力和能力满足项目材料和分包需求的供应商的选择和管理。 管理与新产品导入项目相关的所有采购升级。",0.0,0.0,0.0,0.0,0.0
4,项目管理专员,项目管理,9000.0,交通银行信用卡中心,上海,2.0,本科,岗位职责一、  协助制定和完成指定项目经营指标，对指定项目专项预算进行控制，根据指标有效使用预算。协助完成负责联名卡的年度和季度业务回顾。   二、  与合作伙伴保持有效沟通，按计划执行产品和服务更新。   三、  协助经理策划并执行有联名方特色和优惠的联名卡活动。   四、  协助经理制作项目回顾报告，按期对项目进行年度、季度业务回顾，提升项目管理经验。五、  协助制定联名卡产品生命周期管理办法，有效管理联名卡产品组合，提升合作价值及产品的盈利性。   岗位要求一、  全日制大学本科及以上学历，2年以上相关工作经验二、  具备金融、银行、信用卡、市场营销等相关行业知识  三、  具有一定活动策划及数据分析能力  薪资福利一、  提供具有市场竞争力的薪资待遇； 二、  依法缴纳“五险一金”，并交纳补充公积金和补充商业医疗保险； 三、  提供上、下班交通补贴和其他现金福利，以及节假日和生日慰问； 四、  提供免费早、中工作餐； 五、  依法提供独生子女奖励和入托费用报销； 六、  提供年度健康体检和工作行服； 七、  优于法定休假规定的带薪休假制度。,0.0,0.0,0.0,0.0,0.0
5,项目管理,项目管理,7000.0,宏华集团有限公司,德阳,5.0,本科,任职资格：1、管理专业及机械制造专业，年龄25-40岁；2、5年及以上管理工作经验或者技术工作经验；3、沟通能力较强，具备一定的书写能力；职责描述：1、作为项目组的领导人和决策人，确立组员的分工职责；2、根据项目范围、进度、质量、成本等综合因素的考虑，进行项目的总体规划与阶段计划；3、负责具体项目的管理，制定项目实施计划，进行整体的沟通与协调；4、对潜在的项目风险进行预测和分级，并制定调整计划和应急策略；5、负责项目合同范围外的变更，及时和用户签署变更文件；6、做好与用户的协调和沟通工作，不断提高客户满意度；7、负责协调各种资源完成钻机项目、优化项目生产流程，确保项目按期交付。,0.0,0.0,0.0,0.0,0.0
6,项目管理（数通项目）,项目管理,11500.0,深圳市宇轩网络技术有限公司武汉分公司,武汉,0.0,本科,工作内容：1、参与及负责产品、研发、测试相关流程及制度体系的建设，并负责相关流程在项目中的宣导及落地实施；2、制定项目进度计划，并在实施过程中，开展内、外部人员的沟通及协调工作，督促项目按计划完成；3、负责跟踪、汇总所有项目的进度、质量，进行项目状态分析及考评，对项目执行中的问题要及时反映、督促并协调解决；4、有效地组织召开项目相关会议，做好日常、阶段性及关键里程碑的项目汇报，组织各类评审，检查及验收各阶段项目交付物；5、不断发起必要的变革，采用快速小幅迭代的方式，牵引产品研发体系项目的过程速度、资源效率、结果质量的不断提升；6、对项目定期分析、评估，为决策者提供决策支持。7、支撑PMO体系执行和改进，关注项目过程执行，识别、推进交付体系过程改善。任职要求：1、本科及以上学历，计算机(网络)、软件工程、电子技术，通信相关专业；2、有3-5年以上软件项目管理（PM）工作经验；3、了解部分主流的项目管理，例如PMBOK、ICB、PRINCE2、CMMII等；4、逻辑性思维，良好的人际关系处理能力、沟通能、协调能力，高情商，细致、踏实的完成工作；5、有大中型企业数通项目管理经验优先,0.0,0.0,0.0,0.0,0.0
7,项目管理/项目经理,项目管理,12500.0,浦俄（上海）创业孵化器管理有限公司,上海,3.0,本科,项目管理 工作职责 项目计划  1、组建跨部门的项目团队，依照内部/外部要求制定项目计划；  项目实施  1、定期召开项目会议回顾和监控项目结果，确保项目“按时间、按规范、按预算”进行；  2、与外部客户保持定期联系，以取得他们的支持；  3、与项目组成员保持定期联系，监控和督促客户项目按计划实施；  4、定期向客户及管理层汇报项目情况，及时发现风险，并及时报警  5、与客户和相关部门协同完成所有内部与外部认可；  6、组织项目总结会议以回顾整个项目过程，评估重大风险事件，总结经验；  7、根据质量体系的要求，收集项目文件并归档。 任职要求 1、大专以上学历，理工科相关专业，3年以上公司项目管理或相关产品经验。 2、有技术转移转化、技术转让、技术咨询、技术中介等项目经验者优先； 3、熟练使用EXCEL等办公软件； 4、较强的沟通、理解和分析能力；良好的职业操守及团队合作精神， 5、责任心强，配合度高，工作认真细心、积极热情。福利待遇：公司提供完善的培训和行业内领先的福利待遇，五险一金、带薪培训、项目奖金、年终奖、节日福利等。,1.0,0.0,0.0,0.0,0.0
8,项目管理经理,项目管理,15000.0,上海金取教育科技有限公司,上海,3.0,本科,）根据公司下达的目标，协助总经理制定并完成年度、季度、月销售业绩指标；2）负责销售团队的招聘、培训、管理，建设一支有凝聚力、战斗力的销售团队；3）规划市场目标、方案，进行市场渠道开发，保障项目所需的市场资源；4）负责销售、教学、行政等跨部门的沟通对接，高效合作，提供顾客优质的教学服务；5）参与及指导市场部的线上、线下推广活动、招生与宣传活动。任职要求：1）有教育行业背景，对教育行业极其热爱者优先；2）本科及以上学历，专业不限；有教育培训行业多年销售管理经验者可以放宽到大专学历。；3）3年以上工作经验，1~2年一线销售实战经验，2年以上销售管理、运营管理经验；4）有强烈的事业心、进取心，有学习力、踏实肯干。,0.0,0.0,0.0,0.0,0.0
9,项目管理,项目管理,12500.0,联宝（合肥）电子科技有限公司,合肥,3.0,本科,工作职责:1、产品生命周期管理，组织项目团队制定合理的项目计划，驱动项目团队达成项目既定目标；2、PCR生命周期管理，领导项目团队完成PCR的评估，执行及导入，关注成本优化的机会并落实；3、项目流程的设立，执行，追踪及优化；4、主持参与项目相关之BMS，执行过程管理，及时发现并协调解决与计划相冲突的关键问题点；任职资格:1. 本科及以上学历，电子，会计，英语，商业管理类专业2. 4年及以上电子类项目管理经验 3. 具备团队管理经验，流程优化能力 4. 英语熟练 CET 6以上5. PMP证书6. 6sigma资质优先考虑,0.0,0.0,1.0,0.0,0.0
10,商务经理（项目管理）,项目管理,,瑞银企业管理（中国）有限公司无锡分公司,无锡,5.0,本科,"？ 2+ years of relevant experience in Operations or experience in professional firms/financial institutions preferred ？ Previous experience in or interaction with overseas stakeholders in:  -Business management (BM) -Operations  -Project Management  ？ Fluency in reading and writing business e-mails (English qualification will be considered)Proficient in Microsoft Excel, Word Document and PowerPoint ？ Good analytical skills, quick learner and attention to detail ？ Aptitude for understanding technology and drive process improvements  ？ Independent and able to work with minimum supervision ？ Persistence is a key skill. The role requires frequent follow-up and interaction with junior and senior staff of the bank.  ？ High level of energy and commitment to support across GCOO teams. An ability to be flexible and proactive in solving problems and issues for business management staff. S",1.0,0.0,0.0,1.0,0.0
11,项目管理专员（合肥）(001808),项目管理,7500.0,安徽泽众安全科技有限公司,合肥,3.0,无,						岗位职责:1、结合理论和组织工作实际，制定项目管理模式、方法、流程、规范，推动落地执行并持续改进；2、总结项目管理***实践、工作指导书等，制定各种项目管理有关模板，推广应用并不断优化改进；3、收集、分析项目管理信息化需求，推动项目管理信息化系统的持续优化和完善；4、协调、组织、推进项目管理全过程有关工作；5、推进项目实施工作组织、人员资源安排、工作考核、项目经理培训等的优化、调整、开展；6、对项目体系进行周期性度量分析，编制分析报告，辅助领导决策；7、其他项目管理有关工作。 任职资格:1、本科及以上学历，硕士优先；2、服务意识强，办事效率高，有热情；3、责任心强，认真负责、勇于承担责任；4、有5年以上IT项目管理相关工作经验；5、有IT项目管理、保密资质管理、cmmi等项目管理经验优先。,0.0,0.0,0.0,0.0,0.0
12,科研项目管理经理,项目管理,10000.0,烟台睿创微纳技术股份有限公司,烟台,5.0,本科,按照公司规定，做好科研项目管理，包括计划、组织和控制工作，能有效对项目的进度、质量、成本进行控制并及时报告；做好项目相关部门的沟通衔接工作，及时、高效处理相关问题，确保项目顺利实施；运用项目管理专业知识，修订完善公司项目管理制度。任职资格：本科及以上学历，理工科专业；三年以上集成电路行业相关行业工作经验，已取得项目管理师资格证，系统学习科研项目管理理论知识，熟悉项目管理方法和管理工具；具备优秀的项目推进能力，良好的沟通协调能力，强烈的责任心与敬业精神；熟练掌握Ppt、Word、Excel、Project、Visio等工具。,1.0,0.0,0.0,1.0,1.0
13,项目管理部助理,项目管理,5000.0,深圳市森磊装饰设计工程有限公司,深圳,0.0,无,、负责整理编辑项目管理部各类报表，对各类文件进行分类存档管理；2、负责项目管理部与客户的合同、资料、文件签署管理，并协助做好各类款项追缴工作；3、协助项目管理部领导做好与在建项目负责人、各职能部门的日常对接，配合其完成项目管理工作；4、协助项目管理部统计项目实施推行的进度，根据项目计划，做好督促与考核管理；5、领导安排的其他工作。任职条件：1、土木工程、建筑学、工程管理等相关专业；（亦考虑相关专业优秀毕业生）2、能熟练使用办公自动化（office），熟悉CAD制图软件及BIM软件者优先考虑；3、具备良好的口头及书面表达能力；4、具备较强的沟通协调能力、交际能力和灵活应变能力；,0.0,1.0,0.0,0.0,0.0
14,项目管理工程师,项目管理,12500.0,深圳市金溢科技股份有限公司,深圳,2.0,本科,岗位职责： 1、跟进研发项目从策划、立项、开发、试产、量产的整个过程，分配资源、控制进度，协调处理项目各方遇到的问题； 2、制定项目开发计划文档，负责项目需求沟通并监督产生各阶段项目文档，保证文档的及时、完整和规范； 3、进行项目成本、时间、风险和质量管理； 4、向上级汇报项目的进展情况，需求变更等所有项目信息。  任职资格： 1、本科或以上学历，计算机、通信、电子、交通等相关专业，有PMP证书者优先； 2、有两年或以上年限的项目管理经验，具有车载设备项目管理经验优先； 3、具有项目管理理论与经验，熟悉项目管理方法和管理工具； 4、优秀的组织协调能力，项目控制能力，良好的沟通协调能力，具有良好的团队合作精神。,0.0,0.0,1.0,0.0,0.0
15,项目管理(PA),项目管理,7000.0,上海聚益信息技术有限公司,上海,2.0,本科,"护客户发送的订单及时维护SAP数据;2协助计划及各部门完成订单交付，保证客户满意度;3.对客户日常提出的问题，需及时回应并协调内部相关部门解决, 如客户设计变更等;4.解决项目订单交付过程中遇到的问题,进行原因分析;5.协同采购询价部门持续跟进供应商减价，短缺物料跟踪、质量等问题、确保供应商品质、按期交货;任职要求：  1. 2年或以上电子行业的经验（外资） 2.良好的英语",0.0,0.0,0.0,0.0,0.0
16,项目管理专员,项目管理,4000.0,云南聚天投资有限公司,昆明,1.0,大专,岗位要求年龄：20-35岁；学历：大专及以上学历；有相关管理工作能力者优先考虑；岗位职责负责项目人员的日常管理；负责甲乙双方的对接、沟通等；负责领导分配的工作任务；薪资福利待遇1.提供五险，综合收入3500元以上，有节日礼金，年终奖，带薪年假；2.表现优异者提拔为管理干部，并有机会入股公司与公司共同发展。四、工作时间早8：30-晚5.30 午休1个半小时，双休，国家法定节假日都放假。五、工作地址官渡区官南大道大润发商业广场写字楼1栋7楼7,0.0,0.0,0.0,0.0,0.0
17,项目管理岗（化学、药学、翻译）,项目管理,16666.67,成都中核高通同位素股份有限公司,眉山,5.0,本科,：国际间技术合作与交流主要包括:放射性同位素制备及应用、放射源制备及工业应用等方面技术合作与交流。如国际间技术转让谈判、实施等:2：配合咨询公司开展放射性原料药、放射性药品及放射性医疗器械欧盟、美国注册及认证；含放射源仪器仪表、放射性物质运输容器国际认证等。3.放射性核素、放射源及工业应用研发。岗位要求药学、化学、放射化学及相关专业本科以上，良好的英语口头及书面翻译及写作能力。,0.0,0.0,0.0,0.0,0.0
18,项目管理专员（韩语翻译）,项目管理,6500.0,宁波杰克龙精工有限公司,宁波,0.0,本科,、执行韩籍专家随行翻译工作；2、负责韩籍专家的接待安排等常规事务；3、组织韩籍专家负责研发项目实施推动；4、跟进落实韩籍专家负责的研发项目进度，总结整理实践结果；任职要求：1.本科及以上学历，韩语专业毕业，韩语等级5级以上；2.具备较强的韩语口语表达能力，具备较强的沟通表达及随机应变能力，可接受优秀应届毕业生。职能类别：										韩语/朝鲜语翻译									关键字：韩语朝鲜语项目管理韩语翻译,0.0,0.0,0.0,0.0,0.0
19,VOC项目管理工程师,项目管理,6000.0,美埃（中国）环境净化有限公司,南京,0.0,本科,、负责VOC项目管理，协助销售处理现场问题；2、产品质量问题处理；3、报告反馈问题。任职资格：1、大学本科及以上学历；2、熟练使用办公软件，会CAD制图，懂电路；3、有相关工作经验者优先。,0.0,1.0,0.0,0.0,0.0
20,水处理运营项目管理,项目管理,8000.0,安徽马钢欣巴环保科技有限公司,马鞍山,5.0,大专,【职位描述】:1、水处理系统运营项目管理负责人，负责带领项目现场服务团队处理系统运营工作；2、负责水处理现场运营服务团队的建设与管理；3、协助销售部进行焦化废水处理及工艺化学品市场的推广与开拓；4、协助并完成总经理安排的其他相关工作；5、现场工作人员技能培训。【任职资格】:1、化学工艺、环境工程、水处理等专业大专及以上学历，并掌握水处理工业知识（焦化废水处理行业经验丰富的可放宽专业限制及学历要求）。2、从事水处理服务、现场服务及团队管理工作5年以上，或有5年以上水处理相关工作的管理经验，有项目工作经历，具有管理、技术和商务的能力，能带领团队完成运营管理目标。3、具备良好的人际沟通能力和综合分析能力。4、有较强的组织、沟通、协调、公关、学习能力。5、本职位根据工作安排，可能需要驻外。6、年龄在30—45之间。7、要求敬业度高，具备吃苦耐劳的精神。8、其它技能要求：汽车驾驶，office软件应用、英语阅读。,0.0,0.0,0.0,0.0,0.0
21,项目管理,项目管理,18500.0,海南大圣娱乐有限公司广州分公司,深圳,1.0,本科,【工作职责】1、根据项目计划和时间跟进项目制作，及时协调资源；2、负责推动团队日常执行工作，负责进度跟踪和控制，确保工作按计划完成；3、协助主策划优化游戏制作和开发的流程。【工作要求】1、 本科及以上学历，专业不限；2、 1年及以上游戏项目管理经验，对游戏制作的各方面有深入了解，熟悉游戏开发过程及人员分工；3、 为人负责、积极主动，具备良好团队合作精神；4、 沟通协调能力强，有团队合作精神，具备管理能力，有较强的抗压能力。5、【加分项】英语能力良好，有儿童教育游戏经验者优先。,0.0,0.0,0.0,0.0,0.0
22,临床前项目管理副经理,项目管理,12500.0,南京英派药业有限公司,南京,3.0,本科,职位： l 临床前项目管理专员/副经理   汇报对象： l 运营副总裁   工作地点： l 南京   岗位职责   l 负责协调临床前包括药化、生产、毒理、专利、等各部门之间项目实施的协作，保障项目进度和质量。 l 负责项目计划、流程、SOP和模板等的制定和修订，项目预算制定及执行。 l 负责定期组织项目例会，向公司管理层汇报项目进展。 l 负责组织召开项目讨论会，讨论项目实施中存在的技术难题、开发风险，撰写项目关键评估报告。 l 负责合同的签订及跟踪 l 负责项目数据收集管理归档，协助收集和审阅与项目相关的最新文献信息等，为项目提供信息支持。 l 参与审核相关实验方案和试验报告，组织并参与项目讨论。 l 部门交办的其他事宜。   任职条件   l 药学/生物/化学/分析等相关专业，本科及以上学历，硕士毕业者优先。 l 3年以上新药研发经验。 l 熟练的英语阅读和书写能力，熟练使用project等office相关软件。 l 了解新药研发药化、合成、制剂、质量研究、药理毒理评价以及临床等相关知识，熟练掌握新药研发流程及国内外新药研发相关法规和指导原则。 l 优秀的学习和文献检索、解读能力。 l 工作积极主动，主观能动性强，能够承受项目相关的工作压力； l 优秀的组织和沟通协调能力，以及文字和口头表达能力； l 优秀的计划管理和执行能力；,0.0,0.0,0.0,0.0,0.0
